No.     Time           Source                Destination           Protocol Length Info
     29 0.927570       192.168.1.23          46.105.132.156        TCP      74     37584 → 443 [SYN] Seq=0 Win=64240 Len=0 MSS=1460 SACK_PERM TSval=393377709 TSecr=0 WS=128

Frame 29: 74 bytes on wire (592 bits), 74 bytes captured (592 bits)
Ethernet II, Src: AzureWaveTec_50:78:a5 (b4:8c:9d:50:78:a5), Dst: SagemcomBroa_35:92:33 (38:35:fb:35:92:33)
Internet Protocol Version 4, Src: 192.168.1.23, Dst: 46.105.132.156
Transmission Control Protocol, Src Port: 37584, Dst Port: 443, Seq: 0, Len: 0

No.     Time           Source                Destination           Protocol Length Info
     31 0.943345       46.105.132.156        192.168.1.23          TCP      74     443 → 37584 [SYN, ACK] Seq=0 Ack=1 Win=65160 Len=0 MSS=1452 SACK_PERM TSval=2246053703 TSecr=393377709 WS=128

Frame 31: 74 bytes on wire (592 bits), 74 bytes captured (592 bits)
Ethernet II, Src: SagemcomBroa_35:92:33 (38:35:fb:35:92:33), Dst: AzureWaveTec_50:78:a5 (b4:8c:9d:50:78:a5)
Internet Protocol Version 4, Src: 46.105.132.156, Dst: 192.168.1.23
Transmission Control Protocol, Src Port: 443, Dst Port: 37584, Seq: 0, Ack: 1, Len: 0

No.     Time           Source                Destination           Protocol Length Info
     32 0.943366       192.168.1.23          46.105.132.156        TCP      66     37584 → 443 [ACK] Seq=1 Ack=1 Win=64256 Len=0 TSval=393377725 TSecr=2246053703

Frame 32: 66 bytes on wire (528 bits), 66 bytes captured (528 bits)
Ethernet II, Src: AzureWaveTec_50:78:a5 (b4:8c:9d:50:78:a5), Dst: SagemcomBroa_35:92:33 (38:35:fb:35:92:33)
Internet Protocol Version 4, Src: 192.168.1.23, Dst: 46.105.132.156
Transmission Control Protocol, Src Port: 37584, Dst Port: 443, Seq: 1, Ack: 1, Len: 0

No.     Time           Source                Destination           Protocol Length Info
     33 0.943586       192.168.1.23          46.105.132.156        TCP      1506   37584 → 443 [ACK] Seq=1 Ack=1 Win=64256 Len=1440 TSval=393377725 TSecr=2246053703 [TCP segment of a reassembled PDU]

Frame 33: 1506 bytes on wire (12048 bits), 1506 bytes captured (12048 bits)
Ethernet II, Src: AzureWaveTec_50:78:a5 (b4:8c:9d:50:78:a5), Dst: SagemcomBroa_35:92:33 (38:35:fb:35:92:33)
Internet Protocol Version 4, Src: 192.168.1.23, Dst: 46.105.132.156
Transmission Control Protocol, Src Port: 37584, Dst Port: 443, Seq: 1, Ack: 1, Len: 1440

No.     Time           Source                Destination           Protocol Length Info
     34 0.943587       192.168.1.23          46.105.132.156        TLSv1.3  417    Client Hello (SNI=drive.shadow.tech)

Frame 34: 417 bytes on wire (3336 bits), 417 bytes captured (3336 bits)
Ethernet II, Src: AzureWaveTec_50:78:a5 (b4:8c:9d:50:78:a5), Dst: SagemcomBroa_35:92:33 (38:35:fb:35:92:33)
Internet Protocol Version 4, Src: 192.168.1.23, Dst: 46.105.132.156
Transmission Control Protocol, Src Port: 37584, Dst Port: 443, Seq: 1441, Ack: 1, Len: 351
[2 Reassembled TCP Segments (1791 bytes): #33(1440), #34(351)]
Transport Layer Security

No.     Time           Source                Destination           Protocol Length Info
     57 0.961678       46.105.132.156        192.168.1.23          TCP      66     443 → 37584 [ACK] Seq=1 Ack=1792 Win=64128 Len=0 TSval=2246053721 TSecr=393377725

Frame 57: 66 bytes on wire (528 bits), 66 bytes captured (528 bits)
Ethernet II, Src: SagemcomBroa_35:92:33 (38:35:fb:35:92:33), Dst: AzureWaveTec_50:78:a5 (b4:8c:9d:50:78:a5)
Internet Protocol Version 4, Src: 46.105.132.156, Dst: 192.168.1.23
Transmission Control Protocol, Src Port: 443, Dst Port: 37584, Seq: 1, Ack: 1792, Len: 0

No.     Time           Source                Destination           Protocol Length Info
     58 0.962561       46.105.132.156        192.168.1.23          TLSv1.3  1506   Server Hello, Change Cipher Spec, Application Data

Frame 58: 1506 bytes on wire (12048 bits), 1506 bytes captured (12048 bits)
Ethernet II, Src: SagemcomBroa_35:92:33 (38:35:fb:35:92:33), Dst: AzureWaveTec_50:78:a5 (b4:8c:9d:50:78:a5)
Internet Protocol Version 4, Src: 46.105.132.156, Dst: 192.168.1.23
Transmission Control Protocol, Src Port: 443, Dst Port: 37584, Seq: 1, Ack: 1792, Len: 1440
Transport Layer Security

No.     Time           Source                Destination           Protocol Length Info
     59 0.962574       192.168.1.23          46.105.132.156        TCP      66     37584 → 443 [ACK] Seq=1792 Ack=1441 Win=64128 Len=0 TSval=393377744 TSecr=2246053721

Frame 59: 66 bytes on wire (528 bits), 66 bytes captured (528 bits)
Ethernet II, Src: AzureWaveTec_50:78:a5 (b4:8c:9d:50:78:a5), Dst: SagemcomBroa_35:92:33 (38:35:fb:35:92:33)
Internet Protocol Version 4, Src: 192.168.1.23, Dst: 46.105.132.156
Transmission Control Protocol, Src Port: 37584, Dst Port: 443, Seq: 1792, Ack: 1441, Len: 0

No.     Time           Source                Destination           Protocol Length Info
     60 0.963069       46.105.132.156        192.168.1.23          TCP      1506   443 → 37584 [PSH, ACK] Seq=1441 Ack=1792 Win=64128 Len=1440 TSval=2246053721 TSecr=393377725 [TCP segment of a reassembled PDU]

Frame 60: 1506 bytes on wire (12048 bits), 1506 bytes captured (12048 bits)
Ethernet II, Src: SagemcomBroa_35:92:33 (38:35:fb:35:92:33), Dst: AzureWaveTec_50:78:a5 (b4:8c:9d:50:78:a5)
Internet Protocol Version 4, Src: 46.105.132.156, Dst: 192.168.1.23
Transmission Control Protocol, Src Port: 443, Dst Port: 37584, Seq: 1441, Ack: 1792, Len: 1440

No.     Time           Source                Destination           Protocol Length Info
     61 0.963075       192.168.1.23          46.105.132.156        TCP      66     37584 → 443 [ACK] Seq=1792 Ack=2881 Win=64128 Len=0 TSval=393377745 TSecr=2246053721

Frame 61: 66 bytes on wire (528 bits), 66 bytes captured (528 bits)
Ethernet II, Src: AzureWaveTec_50:78:a5 (b4:8c:9d:50:78:a5), Dst: SagemcomBroa_35:92:33 (38:35:fb:35:92:33)
Internet Protocol Version 4, Src: 192.168.1.23, Dst: 46.105.132.156
Transmission Control Protocol, Src Port: 37584, Dst Port: 443, Seq: 1792, Ack: 2881, Len: 0

No.     Time           Source                Destination           Protocol Length Info
     62 0.963152       46.105.132.156        192.168.1.23          TCP      1282   443 → 37584 [PSH, ACK] Seq=2881 Ack=1792 Win=64128 Len=1216 TSval=2246053721 TSecr=393377725 [TCP segment of a reassembled PDU]

Frame 62: 1282 bytes on wire (10256 bits), 1282 bytes captured (10256 bits)
Ethernet II, Src: SagemcomBroa_35:92:33 (38:35:fb:35:92:33), Dst: AzureWaveTec_50:78:a5 (b4:8c:9d:50:78:a5)
Internet Protocol Version 4, Src: 46.105.132.156, Dst: 192.168.1.23
Transmission Control Protocol, Src Port: 443, Dst Port: 37584, Seq: 2881, Ack: 1792, Len: 1216

No.     Time           Source                Destination           Protocol Length Info
     63 0.963154       192.168.1.23          46.105.132.156        TCP      66     37584 → 443 [ACK] Seq=1792 Ack=4097 Win=64128 Len=0 TSval=393377745 TSecr=2246053721

Frame 63: 66 bytes on wire (528 bits), 66 bytes captured (528 bits)
Ethernet II, Src: AzureWaveTec_50:78:a5 (b4:8c:9d:50:78:a5), Dst: SagemcomBroa_35:92:33 (38:35:fb:35:92:33)
Internet Protocol Version 4, Src: 192.168.1.23, Dst: 46.105.132.156
Transmission Control Protocol, Src Port: 37584, Dst Port: 443, Seq: 1792, Ack: 4097, Len: 0

No.     Time           Source                Destination           Protocol Length Info
     64 0.963255       46.105.132.156        192.168.1.23          TCP      1506   443 → 37584 [ACK] Seq=4097 Ack=1792 Win=64128 Len=1440 TSval=2246053721 TSecr=393377725 [TCP segment of a reassembled PDU]

Frame 64: 1506 bytes on wire (12048 bits), 1506 bytes captured (12048 bits)
Ethernet II, Src: SagemcomBroa_35:92:33 (38:35:fb:35:92:33), Dst: AzureWaveTec_50:78:a5 (b4:8c:9d:50:78:a5)
Internet Protocol Version 4, Src: 46.105.132.156, Dst: 192.168.1.23
Transmission Control Protocol, Src Port: 443, Dst Port: 37584, Seq: 4097, Ack: 1792, Len: 1440

No.     Time           Source                Destination           Protocol Length Info
     65 0.963258       192.168.1.23          46.105.132.156        TCP      66     37584 → 443 [ACK] Seq=1792 Ack=5537 Win=64128 Len=0 TSval=393377745 TSecr=2246053721

Frame 65: 66 bytes on wire (528 bits), 66 bytes captured (528 bits)
Ethernet II, Src: AzureWaveTec_50:78:a5 (b4:8c:9d:50:78:a5), Dst: SagemcomBroa_35:92:33 (38:35:fb:35:92:33)
Internet Protocol Version 4, Src: 192.168.1.23, Dst: 46.105.132.156
Transmission Control Protocol, Src Port: 37584, Dst Port: 443, Seq: 1792, Ack: 5537, Len: 0

No.     Time           Source                Destination           Protocol Length Info
     66 0.963827       46.105.132.156        192.168.1.23          TLSv1.3  1041   Application Data, Application Data, Application Data

Frame 66: 1041 bytes on wire (8328 bits), 1041 bytes captured (8328 bits)
Ethernet II, Src: SagemcomBroa_35:92:33 (38:35:fb:35:92:33), Dst: AzureWaveTec_50:78:a5 (b4:8c:9d:50:78:a5)
Internet Protocol Version 4, Src: 46.105.132.156, Dst: 192.168.1.23
Transmission Control Protocol, Src Port: 443, Dst Port: 37584, Seq: 5537, Ack: 1792, Len: 975
[5 Reassembled TCP Segments (5993 bytes): #58(1266), #60(1440), #62(1216), #64(1440), #66(631)]
Transport Layer Security
Transport Layer Security

No.     Time           Source                Destination           Protocol Length Info
     67 0.963831       192.168.1.23          46.105.132.156        TCP      66     37584 → 443 [ACK] Seq=1792 Ack=6512 Win=64128 Len=0 TSval=393377746 TSecr=2246053721

Frame 67: 66 bytes on wire (528 bits), 66 bytes captured (528 bits)
Ethernet II, Src: AzureWaveTec_50:78:a5 (b4:8c:9d:50:78:a5), Dst: SagemcomBroa_35:92:33 (38:35:fb:35:92:33)
Internet Protocol Version 4, Src: 192.168.1.23, Dst: 46.105.132.156
Transmission Control Protocol, Src Port: 37584, Dst Port: 443, Seq: 1792, Ack: 6512, Len: 0

No.     Time           Source                Destination           Protocol Length Info
     68 0.965554       192.168.1.23          46.105.132.156        TLSv1.3  130    Change Cipher Spec, Application Data

Frame 68: 130 bytes on wire (1040 bits), 130 bytes captured (1040 bits)
Ethernet II, Src: AzureWaveTec_50:78:a5 (b4:8c:9d:50:78:a5), Dst: SagemcomBroa_35:92:33 (38:35:fb:35:92:33)
Internet Protocol Version 4, Src: 192.168.1.23, Dst: 46.105.132.156
Transmission Control Protocol, Src Port: 37584, Dst Port: 443, Seq: 1792, Ack: 6512, Len: 64
Transport Layer Security

No.     Time           Source                Destination           Protocol Length Info
     69 0.965690       192.168.1.23          46.105.132.156        TLSv1.3  158    Application Data

Frame 69: 158 bytes on wire (1264 bits), 158 bytes captured (1264 bits)
Ethernet II, Src: AzureWaveTec_50:78:a5 (b4:8c:9d:50:78:a5), Dst: SagemcomBroa_35:92:33 (38:35:fb:35:92:33)
Internet Protocol Version 4, Src: 192.168.1.23, Dst: 46.105.132.156
Transmission Control Protocol, Src Port: 37584, Dst Port: 443, Seq: 1856, Ack: 6512, Len: 92
Transport Layer Security

No.     Time           Source                Destination           Protocol Length Info
     70 0.965823       192.168.1.23          46.105.132.156        TCP      1506   37584 → 443 [ACK] Seq=1948 Ack=6512 Win=64128 Len=1440 TSval=393377748 TSecr=2246053721 [TCP segment of a reassembled PDU]

Frame 70: 1506 bytes on wire (12048 bits), 1506 bytes captured (12048 bits)
Ethernet II, Src: AzureWaveTec_50:78:a5 (b4:8c:9d:50:78:a5), Dst: SagemcomBroa_35:92:33 (38:35:fb:35:92:33)
Internet Protocol Version 4, Src: 192.168.1.23, Dst: 46.105.132.156
Transmission Control Protocol, Src Port: 37584, Dst Port: 443, Seq: 1948, Ack: 6512, Len: 1440

No.     Time           Source                Destination           Protocol Length Info
     71 0.965825       192.168.1.23          46.105.132.156        TLSv1.3  560    Application Data

Frame 71: 560 bytes on wire (4480 bits), 560 bytes captured (4480 bits)
Ethernet II, Src: AzureWaveTec_50:78:a5 (b4:8c:9d:50:78:a5), Dst: SagemcomBroa_35:92:33 (38:35:fb:35:92:33)
Internet Protocol Version 4, Src: 192.168.1.23, Dst: 46.105.132.156
Transmission Control Protocol, Src Port: 37584, Dst Port: 443, Seq: 3388, Ack: 6512, Len: 494
[2 Reassembled TCP Segments (1934 bytes): #70(1440), #71(494)]
Transport Layer Security

No.     Time           Source                Destination           Protocol Length Info
     80 0.979072       46.105.132.156        192.168.1.23          TLSv1.3  145    Application Data

Frame 80: 145 bytes on wire (1160 bits), 145 bytes captured (1160 bits)
Ethernet II, Src: SagemcomBroa_35:92:33 (38:35:fb:35:92:33), Dst: AzureWaveTec_50:78:a5 (b4:8c:9d:50:78:a5)
Internet Protocol Version 4, Src: 46.105.132.156, Dst: 192.168.1.23
Transmission Control Protocol, Src Port: 443, Dst Port: 37584, Seq: 6512, Ack: 1856, Len: 79
Transport Layer Security

No.     Time           Source                Destination           Protocol Length Info
     81 0.979261       46.105.132.156        192.168.1.23          TLSv1.3  145    Application Data

Frame 81: 145 bytes on wire (1160 bits), 145 bytes captured (1160 bits)
Ethernet II, Src: SagemcomBroa_35:92:33 (38:35:fb:35:92:33), Dst: AzureWaveTec_50:78:a5 (b4:8c:9d:50:78:a5)
Internet Protocol Version 4, Src: 46.105.132.156, Dst: 192.168.1.23
Transmission Control Protocol, Src Port: 443, Dst Port: 37584, Seq: 6591, Ack: 1856, Len: 79
Transport Layer Security

No.     Time           Source                Destination           Protocol Length Info
     82 0.979273       192.168.1.23          46.105.132.156        TCP      66     37584 → 443 [ACK] Seq=3882 Ack=6670 Win=64128 Len=0 TSval=393377761 TSecr=2246053739

Frame 82: 66 bytes on wire (528 bits), 66 bytes captured (528 bits)
Ethernet II, Src: AzureWaveTec_50:78:a5 (b4:8c:9d:50:78:a5), Dst: SagemcomBroa_35:92:33 (38:35:fb:35:92:33)
Internet Protocol Version 4, Src: 192.168.1.23, Dst: 46.105.132.156
Transmission Control Protocol, Src Port: 37584, Dst Port: 443, Seq: 3882, Ack: 6670, Len: 0

No.     Time           Source                Destination           Protocol Length Info
     83 0.983748       46.105.132.156        192.168.1.23          TLSv1.3  130    Application Data

Frame 83: 130 bytes on wire (1040 bits), 130 bytes captured (1040 bits)
Ethernet II, Src: SagemcomBroa_35:92:33 (38:35:fb:35:92:33), Dst: AzureWaveTec_50:78:a5 (b4:8c:9d:50:78:a5)
Internet Protocol Version 4, Src: 46.105.132.156, Dst: 192.168.1.23
Transmission Control Protocol, Src Port: 443, Dst Port: 37584, Seq: 6670, Ack: 1948, Len: 64
Transport Layer Security

No.     Time           Source                Destination           Protocol Length Info
     84 0.983821       192.168.1.23          46.105.132.156        TLSv1.3  97     Application Data

Frame 84: 97 bytes on wire (776 bits), 97 bytes captured (776 bits)
Ethernet II, Src: AzureWaveTec_50:78:a5 (b4:8c:9d:50:78:a5), Dst: SagemcomBroa_35:92:33 (38:35:fb:35:92:33)
Internet Protocol Version 4, Src: 192.168.1.23, Dst: 46.105.132.156
Transmission Control Protocol, Src Port: 37584, Dst Port: 443, Seq: 3882, Ack: 6734, Len: 31
Transport Layer Security

No.     Time           Source                Destination           Protocol Length Info
     86 0.987709       46.105.132.156        192.168.1.23          TCP      66     443 → 37584 [ACK] Seq=6734 Ack=3882 Win=64128 Len=0 TSval=2246053742 TSecr=393377748

Frame 86: 66 bytes on wire (528 bits), 66 bytes captured (528 bits)
Ethernet II, Src: SagemcomBroa_35:92:33 (38:35:fb:35:92:33), Dst: AzureWaveTec_50:78:a5 (b4:8c:9d:50:78:a5)
Internet Protocol Version 4, Src: 46.105.132.156, Dst: 192.168.1.23
Transmission Control Protocol, Src Port: 443, Dst Port: 37584, Seq: 6734, Ack: 3882, Len: 0

No.     Time           Source                Destination           Protocol Length Info
     95 1.024286       46.105.132.156        192.168.1.23          TLSv1.3  1248   Application Data

Frame 95: 1248 bytes on wire (9984 bits), 1248 bytes captured (9984 bits)
Ethernet II, Src: SagemcomBroa_35:92:33 (38:35:fb:35:92:33), Dst: AzureWaveTec_50:78:a5 (b4:8c:9d:50:78:a5)
Internet Protocol Version 4, Src: 46.105.132.156, Dst: 192.168.1.23
Transmission Control Protocol, Src Port: 443, Dst Port: 37584, Seq: 6734, Ack: 3913, Len: 1182
Transport Layer Security

No.     Time           Source                Destination           Protocol Length Info
     96 1.026871       192.168.1.23          46.105.132.156        TLSv1.3  297    Application Data

Frame 96: 297 bytes on wire (2376 bits), 297 bytes captured (2376 bits)
Ethernet II, Src: AzureWaveTec_50:78:a5 (b4:8c:9d:50:78:a5), Dst: SagemcomBroa_35:92:33 (38:35:fb:35:92:33)
Internet Protocol Version 4, Src: 192.168.1.23, Dst: 46.105.132.156
Transmission Control Protocol, Src Port: 37584, Dst Port: 443, Seq: 3913, Ack: 7916, Len: 231
Transport Layer Security

No.     Time           Source                Destination           Protocol Length Info
    107 1.078824       46.105.132.156        192.168.1.23          TLSv1.3  1014   Application Data

Frame 107: 1014 bytes on wire (8112 bits), 1014 bytes captured (8112 bits)
Ethernet II, Src: SagemcomBroa_35:92:33 (38:35:fb:35:92:33), Dst: AzureWaveTec_50:78:a5 (b4:8c:9d:50:78:a5)
Internet Protocol Version 4, Src: 46.105.132.156, Dst: 192.168.1.23
Transmission Control Protocol, Src Port: 443, Dst Port: 37584, Seq: 7916, Ack: 4144, Len: 948
Transport Layer Security

No.     Time           Source                Destination           Protocol Length Info
    108 1.081555       192.168.1.23          46.105.132.156        TLSv1.3  154    Application Data

Frame 108: 154 bytes on wire (1232 bits), 154 bytes captured (1232 bits)
Ethernet II, Src: AzureWaveTec_50:78:a5 (b4:8c:9d:50:78:a5), Dst: SagemcomBroa_35:92:33 (38:35:fb:35:92:33)
Internet Protocol Version 4, Src: 192.168.1.23, Dst: 46.105.132.156
Transmission Control Protocol, Src Port: 37584, Dst Port: 443, Seq: 4144, Ack: 8864, Len: 88
Transport Layer Security

No.     Time           Source                Destination           Protocol Length Info
    145 1.143141       46.105.132.156        192.168.1.23          TLSv1.3  1298   Application Data

Frame 145: 1298 bytes on wire (10384 bits), 1298 bytes captured (10384 bits)
Ethernet II, Src: SagemcomBroa_35:92:33 (38:35:fb:35:92:33), Dst: AzureWaveTec_50:78:a5 (b4:8c:9d:50:78:a5)
Internet Protocol Version 4, Src: 46.105.132.156, Dst: 192.168.1.23
Transmission Control Protocol, Src Port: 443, Dst Port: 37584, Seq: 8864, Ack: 4232, Len: 1232
Transport Layer Security

No.     Time           Source                Destination           Protocol Length Info
    171 1.187821       192.168.1.23          46.105.132.156        TCP      66     37584 → 443 [ACK] Seq=4232 Ack=10096 Win=64128 Len=0 TSval=393377970 TSecr=2246053902

Frame 171: 66 bytes on wire (528 bits), 66 bytes captured (528 bits)
Ethernet II, Src: AzureWaveTec_50:78:a5 (b4:8c:9d:50:78:a5), Dst: SagemcomBroa_35:92:33 (38:35:fb:35:92:33)
Internet Protocol Version 4, Src: 192.168.1.23, Dst: 46.105.132.156
Transmission Control Protocol, Src Port: 37584, Dst Port: 443, Seq: 4232, Ack: 10096, Len: 0

No.     Time           Source                Destination           Protocol Length Info
   1125 4.856421       192.168.1.23          46.105.132.156        TLSv1.3  428    Application Data

Frame 1125: 428 bytes on wire (3424 bits), 428 bytes captured (3424 bits)
Ethernet II, Src: AzureWaveTec_50:78:a5 (b4:8c:9d:50:78:a5), Dst: SagemcomBroa_35:92:33 (38:35:fb:35:92:33)
Internet Protocol Version 4, Src: 192.168.1.23, Dst: 46.105.132.156
Transmission Control Protocol, Src Port: 37584, Dst Port: 443, Seq: 4232, Ack: 10096, Len: 362
Transport Layer Security

No.     Time           Source                Destination           Protocol Length Info
   1131 4.915687       46.105.132.156        192.168.1.23          TCP      66     443 → 37584 [ACK] Seq=10096 Ack=4594 Win=64128 Len=0 TSval=2246057673 TSecr=393381638

Frame 1131: 66 bytes on wire (528 bits), 66 bytes captured (528 bits)
Ethernet II, Src: SagemcomBroa_35:92:33 (38:35:fb:35:92:33), Dst: AzureWaveTec_50:78:a5 (b4:8c:9d:50:78:a5)
Internet Protocol Version 4, Src: 46.105.132.156, Dst: 192.168.1.23
Transmission Control Protocol, Src Port: 443, Dst Port: 37584, Seq: 10096, Ack: 4594, Len: 0

No.     Time           Source                Destination           Protocol Length Info
   1132 5.347076       46.105.132.156        192.168.1.23          TLSv1.3  947    Application Data

Frame 1132: 947 bytes on wire (7576 bits), 947 bytes captured (7576 bits)
Ethernet II, Src: SagemcomBroa_35:92:33 (38:35:fb:35:92:33), Dst: AzureWaveTec_50:78:a5 (b4:8c:9d:50:78:a5)
Internet Protocol Version 4, Src: 46.105.132.156, Dst: 192.168.1.23
Transmission Control Protocol, Src Port: 443, Dst Port: 37584, Seq: 10096, Ack: 4594, Len: 881
Transport Layer Security

No.     Time           Source                Destination           Protocol Length Info
   1133 5.347117       192.168.1.23          46.105.132.156        TCP      66     37584 → 443 [ACK] Seq=4594 Ack=10977 Win=64128 Len=0 TSval=393382129 TSecr=2246058101

Frame 1133: 66 bytes on wire (528 bits), 66 bytes captured (528 bits)
Ethernet II, Src: AzureWaveTec_50:78:a5 (b4:8c:9d:50:78:a5), Dst: SagemcomBroa_35:92:33 (38:35:fb:35:92:33)
Internet Protocol Version 4, Src: 192.168.1.23, Dst: 46.105.132.156
Transmission Control Protocol, Src Port: 37584, Dst Port: 443, Seq: 4594, Ack: 10977, Len: 0

No.     Time           Source                Destination           Protocol Length Info
   1134 5.352125       192.168.1.23          46.105.132.156        TLSv1.3  167    Application Data

Frame 1134: 167 bytes on wire (1336 bits), 167 bytes captured (1336 bits)
Ethernet II, Src: AzureWaveTec_50:78:a5 (b4:8c:9d:50:78:a5), Dst: SagemcomBroa_35:92:33 (38:35:fb:35:92:33)
Internet Protocol Version 4, Src: 192.168.1.23, Dst: 46.105.132.156
Transmission Control Protocol, Src Port: 37584, Dst Port: 443, Seq: 4594, Ack: 10977, Len: 101
Transport Layer Security

No.     Time           Source                Destination           Protocol Length Info
   1135 5.389563       46.105.132.156        192.168.1.23          TCP      66     443 → 37584 [ACK] Seq=10977 Ack=4695 Win=64128 Len=0 TSval=2246058125 TSecr=393382134

Frame 1135: 66 bytes on wire (528 bits), 66 bytes captured (528 bits)
Ethernet II, Src: SagemcomBroa_35:92:33 (38:35:fb:35:92:33), Dst: AzureWaveTec_50:78:a5 (b4:8c:9d:50:78:a5)
Internet Protocol Version 4, Src: 46.105.132.156, Dst: 192.168.1.23
Transmission Control Protocol, Src Port: 443, Dst Port: 37584, Seq: 10977, Ack: 4695, Len: 0

No.     Time           Source                Destination           Protocol Length Info
   1136 5.430538       46.105.132.156        192.168.1.23          TLSv1.3  922    Application Data

Frame 1136: 922 bytes on wire (7376 bits), 922 bytes captured (7376 bits)
Ethernet II, Src: SagemcomBroa_35:92:33 (38:35:fb:35:92:33), Dst: AzureWaveTec_50:78:a5 (b4:8c:9d:50:78:a5)
Internet Protocol Version 4, Src: 46.105.132.156, Dst: 192.168.1.23
Transmission Control Protocol, Src Port: 443, Dst Port: 37584, Seq: 10977, Ack: 4695, Len: 856
Transport Layer Security

No.     Time           Source                Destination           Protocol Length Info
   1137 5.436426       192.168.1.23          46.105.132.156        TLSv1.3  262    Application Data

Frame 1137: 262 bytes on wire (2096 bits), 262 bytes captured (2096 bits)
Ethernet II, Src: AzureWaveTec_50:78:a5 (b4:8c:9d:50:78:a5), Dst: SagemcomBroa_35:92:33 (38:35:fb:35:92:33)
Internet Protocol Version 4, Src: 192.168.1.23, Dst: 46.105.132.156
Transmission Control Protocol, Src Port: 37584, Dst Port: 443, Seq: 4695, Ack: 11833, Len: 196
Transport Layer Security

No.     Time           Source                Destination           Protocol Length Info
   1139 5.450783       46.105.132.156        192.168.1.23          TCP      66     443 → 37584 [ACK] Seq=11833 Ack=4891 Win=64128 Len=0 TSval=2246058210 TSecr=393382218

Frame 1139: 66 bytes on wire (528 bits), 66 bytes captured (528 bits)
Ethernet II, Src: SagemcomBroa_35:92:33 (38:35:fb:35:92:33), Dst: AzureWaveTec_50:78:a5 (b4:8c:9d:50:78:a5)
Internet Protocol Version 4, Src: 46.105.132.156, Dst: 192.168.1.23
Transmission Control Protocol, Src Port: 443, Dst Port: 37584, Seq: 11833, Ack: 4891, Len: 0

No.     Time           Source                Destination           Protocol Length Info
   1143 5.570215       46.105.132.156        192.168.1.23          TCP      1506   443 → 37584 [ACK] Seq=11833 Ack=4891 Win=64128 Len=1440 TSval=2246058329 TSecr=393382218 [TCP segment of a reassembled PDU]

Frame 1143: 1506 bytes on wire (12048 bits), 1506 bytes captured (12048 bits)
Ethernet II, Src: SagemcomBroa_35:92:33 (38:35:fb:35:92:33), Dst: AzureWaveTec_50:78:a5 (b4:8c:9d:50:78:a5)
Internet Protocol Version 4, Src: 46.105.132.156, Dst: 192.168.1.23
Transmission Control Protocol, Src Port: 443, Dst Port: 37584, Seq: 11833, Ack: 4891, Len: 1440

No.     Time           Source                Destination           Protocol Length Info
   1144 5.570779       46.105.132.156        192.168.1.23          TCP      1506   443 → 37584 [PSH, ACK] Seq=13273 Ack=4891 Win=64128 Len=1440 TSval=2246058329 TSecr=393382218 [TCP segment of a reassembled PDU]

Frame 1144: 1506 bytes on wire (12048 bits), 1506 bytes captured (12048 bits)
Ethernet II, Src: SagemcomBroa_35:92:33 (38:35:fb:35:92:33), Dst: AzureWaveTec_50:78:a5 (b4:8c:9d:50:78:a5)
Internet Protocol Version 4, Src: 46.105.132.156, Dst: 192.168.1.23
Transmission Control Protocol, Src Port: 443, Dst Port: 37584, Seq: 13273, Ack: 4891, Len: 1440

No.     Time           Source                Destination           Protocol Length Info
   1145 5.570801       192.168.1.23          46.105.132.156        TCP      66     37584 → 443 [ACK] Seq=4891 Ack=14713 Win=64128 Len=0 TSval=393382353 TSecr=2246058329

Frame 1145: 66 bytes on wire (528 bits), 66 bytes captured (528 bits)
Ethernet II, Src: AzureWaveTec_50:78:a5 (b4:8c:9d:50:78:a5), Dst: SagemcomBroa_35:92:33 (38:35:fb:35:92:33)
Internet Protocol Version 4, Src: 192.168.1.23, Dst: 46.105.132.156
Transmission Control Protocol, Src Port: 37584, Dst Port: 443, Seq: 4891, Ack: 14713, Len: 0

No.     Time           Source                Destination           Protocol Length Info
   1146 5.571007       46.105.132.156        192.168.1.23          TCP      1506   443 → 37584 [ACK] Seq=14713 Ack=4891 Win=64128 Len=1440 TSval=2246058329 TSecr=393382218 [TCP segment of a reassembled PDU]

Frame 1146: 1506 bytes on wire (12048 bits), 1506 bytes captured (12048 bits)
Ethernet II, Src: SagemcomBroa_35:92:33 (38:35:fb:35:92:33), Dst: AzureWaveTec_50:78:a5 (b4:8c:9d:50:78:a5)
Internet Protocol Version 4, Src: 46.105.132.156, Dst: 192.168.1.23
Transmission Control Protocol, Src Port: 443, Dst Port: 37584, Seq: 14713, Ack: 4891, Len: 1440

No.     Time           Source                Destination           Protocol Length Info
   1147 5.571568       46.105.132.156        192.168.1.23          TCP      1506   443 → 37584 [PSH, ACK] Seq=16153 Ack=4891 Win=64128 Len=1440 TSval=2246058329 TSecr=393382218 [TCP segment of a reassembled PDU]

Frame 1147: 1506 bytes on wire (12048 bits), 1506 bytes captured (12048 bits)
Ethernet II, Src: SagemcomBroa_35:92:33 (38:35:fb:35:92:33), Dst: AzureWaveTec_50:78:a5 (b4:8c:9d:50:78:a5)
Internet Protocol Version 4, Src: 46.105.132.156, Dst: 192.168.1.23
Transmission Control Protocol, Src Port: 443, Dst Port: 37584, Seq: 16153, Ack: 4891, Len: 1440

No.     Time           Source                Destination           Protocol Length Info
   1148 5.571582       192.168.1.23          46.105.132.156        TCP      66     37584 → 443 [ACK] Seq=4891 Ack=17593 Win=64128 Len=0 TSval=393382353 TSecr=2246058329

Frame 1148: 66 bytes on wire (528 bits), 66 bytes captured (528 bits)
Ethernet II, Src: AzureWaveTec_50:78:a5 (b4:8c:9d:50:78:a5), Dst: SagemcomBroa_35:92:33 (38:35:fb:35:92:33)
Internet Protocol Version 4, Src: 192.168.1.23, Dst: 46.105.132.156
Transmission Control Protocol, Src Port: 37584, Dst Port: 443, Seq: 4891, Ack: 17593, Len: 0

No.     Time           Source                Destination           Protocol Length Info
   1149 5.572183       46.105.132.156        192.168.1.23          TCP      1506   443 → 37584 [ACK] Seq=17593 Ack=4891 Win=64128 Len=1440 TSval=2246058329 TSecr=393382218 [TCP segment of a reassembled PDU]

Frame 1149: 1506 bytes on wire (12048 bits), 1506 bytes captured (12048 bits)
Ethernet II, Src: SagemcomBroa_35:92:33 (38:35:fb:35:92:33), Dst: AzureWaveTec_50:78:a5 (b4:8c:9d:50:78:a5)
Internet Protocol Version 4, Src: 46.105.132.156, Dst: 192.168.1.23
Transmission Control Protocol, Src Port: 443, Dst Port: 37584, Seq: 17593, Ack: 4891, Len: 1440

No.     Time           Source                Destination           Protocol Length Info
   1150 5.572545       46.105.132.156        192.168.1.23          TCP      1506   443 → 37584 [PSH, ACK] Seq=19033 Ack=4891 Win=64128 Len=1440 TSval=2246058329 TSecr=393382218 [TCP segment of a reassembled PDU]

Frame 1150: 1506 bytes on wire (12048 bits), 1506 bytes captured (12048 bits)
Ethernet II, Src: SagemcomBroa_35:92:33 (38:35:fb:35:92:33), Dst: AzureWaveTec_50:78:a5 (b4:8c:9d:50:78:a5)
Internet Protocol Version 4, Src: 46.105.132.156, Dst: 192.168.1.23
Transmission Control Protocol, Src Port: 443, Dst Port: 37584, Seq: 19033, Ack: 4891, Len: 1440

No.     Time           Source                Destination           Protocol Length Info
   1151 5.572560       192.168.1.23          46.105.132.156        TCP      66     37584 → 443 [ACK] Seq=4891 Ack=20473 Win=64128 Len=0 TSval=393382354 TSecr=2246058329

Frame 1151: 66 bytes on wire (528 bits), 66 bytes captured (528 bits)
Ethernet II, Src: AzureWaveTec_50:78:a5 (b4:8c:9d:50:78:a5), Dst: SagemcomBroa_35:92:33 (38:35:fb:35:92:33)
Internet Protocol Version 4, Src: 192.168.1.23, Dst: 46.105.132.156
Transmission Control Protocol, Src Port: 37584, Dst Port: 443, Seq: 4891, Ack: 20473, Len: 0

No.     Time           Source                Destination           Protocol Length Info
   1152 5.574421       46.105.132.156        192.168.1.23          TCP      2946   443 → 37584 [PSH, ACK] Seq=20473 Ack=4891 Win=64128 Len=2880 TSval=2246058329 TSecr=393382218 [TCP segment of a reassembled PDU]

Frame 1152: 2946 bytes on wire (23568 bits), 2946 bytes captured (23568 bits)
Ethernet II, Src: SagemcomBroa_35:92:33 (38:35:fb:35:92:33), Dst: AzureWaveTec_50:78:a5 (b4:8c:9d:50:78:a5)
Internet Protocol Version 4, Src: 46.105.132.156, Dst: 192.168.1.23
Transmission Control Protocol, Src Port: 443, Dst Port: 37584, Seq: 20473, Ack: 4891, Len: 2880

No.     Time           Source                Destination           Protocol Length Info
   1153 5.574487       192.168.1.23          46.105.132.156        TCP      66     37584 → 443 [ACK] Seq=4891 Ack=23353 Win=64128 Len=0 TSval=393382356 TSecr=2246058329

Frame 1153: 66 bytes on wire (528 bits), 66 bytes captured (528 bits)
Ethernet II, Src: AzureWaveTec_50:78:a5 (b4:8c:9d:50:78:a5), Dst: SagemcomBroa_35:92:33 (38:35:fb:35:92:33)
Internet Protocol Version 4, Src: 192.168.1.23, Dst: 46.105.132.156
Transmission Control Protocol, Src Port: 37584, Dst Port: 443, Seq: 4891, Ack: 23353, Len: 0

No.     Time           Source                Destination           Protocol Length Info
   1154 5.575936       46.105.132.156        192.168.1.23          TCP      2946   443 → 37584 [PSH, ACK] Seq=23353 Ack=4891 Win=64128 Len=2880 TSval=2246058329 TSecr=393382218 [TCP segment of a reassembled PDU]

Frame 1154: 2946 bytes on wire (23568 bits), 2946 bytes captured (23568 bits)
Ethernet II, Src: SagemcomBroa_35:92:33 (38:35:fb:35:92:33), Dst: AzureWaveTec_50:78:a5 (b4:8c:9d:50:78:a5)
Internet Protocol Version 4, Src: 46.105.132.156, Dst: 192.168.1.23
Transmission Control Protocol, Src Port: 443, Dst Port: 37584, Seq: 23353, Ack: 4891, Len: 2880

No.     Time           Source                Destination           Protocol Length Info
   1155 5.576027       192.168.1.23          46.105.132.156        TCP      66     37584 → 443 [ACK] Seq=4891 Ack=26233 Win=64128 Len=0 TSval=393382358 TSecr=2246058329

Frame 1155: 66 bytes on wire (528 bits), 66 bytes captured (528 bits)
Ethernet II, Src: AzureWaveTec_50:78:a5 (b4:8c:9d:50:78:a5), Dst: SagemcomBroa_35:92:33 (38:35:fb:35:92:33)
Internet Protocol Version 4, Src: 192.168.1.23, Dst: 46.105.132.156
Transmission Control Protocol, Src Port: 37584, Dst Port: 443, Seq: 4891, Ack: 26233, Len: 0

No.     Time           Source                Destination           Protocol Length Info
   1156 5.586660       46.105.132.156        192.168.1.23          TLSv1.3  1231   Application Data

Frame 1156: 1231 bytes on wire (9848 bits), 1231 bytes captured (9848 bits)
Ethernet II, Src: SagemcomBroa_35:92:33 (38:35:fb:35:92:33), Dst: AzureWaveTec_50:78:a5 (b4:8c:9d:50:78:a5)
Internet Protocol Version 4, Src: 46.105.132.156, Dst: 192.168.1.23
Transmission Control Protocol, Src Port: 443, Dst Port: 37584, Seq: 26233, Ack: 4891, Len: 1165
[9 Reassembled TCP Segments (15565 bytes): #1143(1440), #1144(1440), #1146(1440), #1147(1440), #1149(1440), #1150(1440), #1152(2880), #1154(2880), #1156(1165)]
Transport Layer Security

No.     Time           Source                Destination           Protocol Length Info
   1163 5.631787       192.168.1.23          46.105.132.156        TCP      66     37584 → 443 [ACK] Seq=4891 Ack=27398 Win=64128 Len=0 TSval=393382414 TSecr=2246058344

Frame 1163: 66 bytes on wire (528 bits), 66 bytes captured (528 bits)
Ethernet II, Src: AzureWaveTec_50:78:a5 (b4:8c:9d:50:78:a5), Dst: SagemcomBroa_35:92:33 (38:35:fb:35:92:33)
Internet Protocol Version 4, Src: 192.168.1.23, Dst: 46.105.132.156
Transmission Control Protocol, Src Port: 37584, Dst Port: 443, Seq: 4891, Ack: 27398, Len: 0

No.     Time           Source                Destination           Protocol Length Info
   1193 6.151875       192.168.1.23          46.105.132.156        TLSv1.3  393    Application Data

Frame 1193: 393 bytes on wire (3144 bits), 393 bytes captured (3144 bits)
Ethernet II, Src: AzureWaveTec_50:78:a5 (b4:8c:9d:50:78:a5), Dst: SagemcomBroa_35:92:33 (38:35:fb:35:92:33)
Internet Protocol Version 4, Src: 192.168.1.23, Dst: 46.105.132.156
Transmission Control Protocol, Src Port: 37584, Dst Port: 443, Seq: 4891, Ack: 27398, Len: 327
Transport Layer Security

No.     Time           Source                Destination           Protocol Length Info
   1194 6.168785       46.105.132.156        192.168.1.23          TCP      66     443 → 37584 [ACK] Seq=27398 Ack=5218 Win=64128 Len=0 TSval=2246058928 TSecr=393382934

Frame 1194: 66 bytes on wire (528 bits), 66 bytes captured (528 bits)
Ethernet II, Src: SagemcomBroa_35:92:33 (38:35:fb:35:92:33), Dst: AzureWaveTec_50:78:a5 (b4:8c:9d:50:78:a5)
Internet Protocol Version 4, Src: 46.105.132.156, Dst: 192.168.1.23
Transmission Control Protocol, Src Port: 443, Dst Port: 37584, Seq: 27398, Ack: 5218, Len: 0

No.     Time           Source                Destination           Protocol Length Info
   1195 6.231706       46.105.132.156        192.168.1.23          TLSv1.3  1103   Application Data

Frame 1195: 1103 bytes on wire (8824 bits), 1103 bytes captured (8824 bits)
Ethernet II, Src: SagemcomBroa_35:92:33 (38:35:fb:35:92:33), Dst: AzureWaveTec_50:78:a5 (b4:8c:9d:50:78:a5)
Internet Protocol Version 4, Src: 46.105.132.156, Dst: 192.168.1.23
Transmission Control Protocol, Src Port: 443, Dst Port: 37584, Seq: 27398, Ack: 5218, Len: 1037
Transport Layer Security

No.     Time           Source                Destination           Protocol Length Info
   1196 6.231725       192.168.1.23          46.105.132.156        TCP      66     37584 → 443 [ACK] Seq=5218 Ack=28435 Win=64128 Len=0 TSval=393383013 TSecr=2246058991

Frame 1196: 66 bytes on wire (528 bits), 66 bytes captured (528 bits)
Ethernet II, Src: AzureWaveTec_50:78:a5 (b4:8c:9d:50:78:a5), Dst: SagemcomBroa_35:92:33 (38:35:fb:35:92:33)
Internet Protocol Version 4, Src: 192.168.1.23, Dst: 46.105.132.156
Transmission Control Protocol, Src Port: 37584, Dst Port: 443, Seq: 5218, Ack: 28435, Len: 0

No.     Time           Source                Destination           Protocol Length Info
   1197 6.232749       192.168.1.23          46.105.132.156        TLSv1.3  101    Application Data

Frame 1197: 101 bytes on wire (808 bits), 101 bytes captured (808 bits)
Ethernet II, Src: AzureWaveTec_50:78:a5 (b4:8c:9d:50:78:a5), Dst: SagemcomBroa_35:92:33 (38:35:fb:35:92:33)
Internet Protocol Version 4, Src: 192.168.1.23, Dst: 46.105.132.156
Transmission Control Protocol, Src Port: 37584, Dst Port: 443, Seq: 5218, Ack: 28435, Len: 35
Transport Layer Security

No.     Time           Source                Destination           Protocol Length Info
   1198 6.246486       46.105.132.156        192.168.1.23          TCP      66     443 → 37584 [ACK] Seq=28435 Ack=5253 Win=64128 Len=0 TSval=2246059006 TSecr=393383014

Frame 1198: 66 bytes on wire (528 bits), 66 bytes captured (528 bits)
Ethernet II, Src: SagemcomBroa_35:92:33 (38:35:fb:35:92:33), Dst: AzureWaveTec_50:78:a5 (b4:8c:9d:50:78:a5)
Internet Protocol Version 4, Src: 46.105.132.156, Dst: 192.168.1.23
Transmission Control Protocol, Src Port: 443, Dst Port: 37584, Seq: 28435, Ack: 5253, Len: 0

No.     Time           Source                Destination           Protocol Length Info
   1199 6.768834       192.168.1.23          46.105.132.156        TCP      1506   37584 → 443 [ACK] Seq=5253 Ack=28435 Win=64128 Len=1440 TSval=393383551 TSecr=2246059006 [TCP segment of a reassembled PDU]

Frame 1199: 1506 bytes on wire (12048 bits), 1506 bytes captured (12048 bits)
Ethernet II, Src: AzureWaveTec_50:78:a5 (b4:8c:9d:50:78:a5), Dst: SagemcomBroa_35:92:33 (38:35:fb:35:92:33)
Internet Protocol Version 4, Src: 192.168.1.23, Dst: 46.105.132.156
Transmission Control Protocol, Src Port: 37584, Dst Port: 443, Seq: 5253, Ack: 28435, Len: 1440

No.     Time           Source                Destination           Protocol Length Info
   1200 6.768841       192.168.1.23          46.105.132.156        TLSv1.3  125    Application Data

Frame 1200: 125 bytes on wire (1000 bits), 125 bytes captured (1000 bits)
Ethernet II, Src: AzureWaveTec_50:78:a5 (b4:8c:9d:50:78:a5), Dst: SagemcomBroa_35:92:33 (38:35:fb:35:92:33)
Internet Protocol Version 4, Src: 192.168.1.23, Dst: 46.105.132.156
Transmission Control Protocol, Src Port: 37584, Dst Port: 443, Seq: 6693, Ack: 28435, Len: 59
[2 Reassembled TCP Segments (1499 bytes): #1199(1440), #1200(59)]
Transport Layer Security

No.     Time           Source                Destination           Protocol Length Info
   1201 6.771947       192.168.1.23          46.105.132.156        TLSv1.3  167    Application Data

Frame 1201: 167 bytes on wire (1336 bits), 167 bytes captured (1336 bits)
Ethernet II, Src: AzureWaveTec_50:78:a5 (b4:8c:9d:50:78:a5), Dst: SagemcomBroa_35:92:33 (38:35:fb:35:92:33)
Internet Protocol Version 4, Src: 192.168.1.23, Dst: 46.105.132.156
Transmission Control Protocol, Src Port: 37584, Dst Port: 443, Seq: 6752, Ack: 28435, Len: 101
Transport Layer Security

No.     Time           Source                Destination           Protocol Length Info
   1202 6.772556       192.168.1.23          46.105.132.156        TLSv1.3  374    Application Data

Frame 1202: 374 bytes on wire (2992 bits), 374 bytes captured (2992 bits)
Ethernet II, Src: AzureWaveTec_50:78:a5 (b4:8c:9d:50:78:a5), Dst: SagemcomBroa_35:92:33 (38:35:fb:35:92:33)
