No.     Time           Source                Destination           Protocol Length Info
     62 2.181680       192.168.1.23          46.105.132.157        TCP      74     51810 → 443 [SYN] Seq=0 Win=64240 Len=0 MSS=1460 SACK_PERM TSval=1359914125 TSecr=0 WS=128

Frame 62: 74 bytes on wire (592 bits), 74 bytes captured (592 bits)
Ethernet II, Src: AzureWaveTec_50:78:a5 (b4:8c:9d:50:78:a5), Dst: SagemcomBroa_35:92:33 (38:35:fb:35:92:33)
Internet Protocol Version 4, Src: 192.168.1.23, Dst: 46.105.132.157
Transmission Control Protocol, Src Port: 51810, Dst Port: 443, Seq: 0, Len: 0

No.     Time           Source                Destination           Protocol Length Info
     66 2.195900       46.105.132.157        192.168.1.23          TCP      74     443 → 51810 [SYN, ACK] Seq=0 Ack=1 Win=65160 Len=0 MSS=1452 SACK_PERM TSval=2608476651 TSecr=1359914125 WS=128

Frame 66: 74 bytes on wire (592 bits), 74 bytes captured (592 bits)
Ethernet II, Src: SagemcomBroa_35:92:33 (38:35:fb:35:92:33), Dst: AzureWaveTec_50:78:a5 (b4:8c:9d:50:78:a5)
Internet Protocol Version 4, Src: 46.105.132.157, Dst: 192.168.1.23
Transmission Control Protocol, Src Port: 443, Dst Port: 51810, Seq: 0, Ack: 1, Len: 0

No.     Time           Source                Destination           Protocol Length Info
     67 2.195954       192.168.1.23          46.105.132.157        TCP      66     51810 → 443 [ACK] Seq=1 Ack=1 Win=64256 Len=0 TSval=1359914140 TSecr=2608476651

Frame 67: 66 bytes on wire (528 bits), 66 bytes captured (528 bits)
Ethernet II, Src: AzureWaveTec_50:78:a5 (b4:8c:9d:50:78:a5), Dst: SagemcomBroa_35:92:33 (38:35:fb:35:92:33)
Internet Protocol Version 4, Src: 192.168.1.23, Dst: 46.105.132.157
Transmission Control Protocol, Src Port: 51810, Dst Port: 443, Seq: 1, Ack: 1, Len: 0

No.     Time           Source                Destination           Protocol Length Info
     69 2.197122       192.168.1.23          46.105.132.157        TCP      1506   51810 → 443 [ACK] Seq=1 Ack=1 Win=64256 Len=1440 TSval=1359914141 TSecr=2608476651 [TCP segment of a reassembled PDU]

Frame 69: 1506 bytes on wire (12048 bits), 1506 bytes captured (12048 bits)
Ethernet II, Src: AzureWaveTec_50:78:a5 (b4:8c:9d:50:78:a5), Dst: SagemcomBroa_35:92:33 (38:35:fb:35:92:33)
Internet Protocol Version 4, Src: 192.168.1.23, Dst: 46.105.132.157
Transmission Control Protocol, Src Port: 51810, Dst Port: 443, Seq: 1, Ack: 1, Len: 1440

No.     Time           Source                Destination           Protocol Length Info
     70 2.197130       192.168.1.23          46.105.132.157        TLSv1.3  417    Client Hello (SNI=drive.shadow.tech)

Frame 70: 417 bytes on wire (3336 bits), 417 bytes captured (3336 bits)
Ethernet II, Src: AzureWaveTec_50:78:a5 (b4:8c:9d:50:78:a5), Dst: SagemcomBroa_35:92:33 (38:35:fb:35:92:33)
Internet Protocol Version 4, Src: 192.168.1.23, Dst: 46.105.132.157
Transmission Control Protocol, Src Port: 51810, Dst Port: 443, Seq: 1441, Ack: 1, Len: 351
[2 Reassembled TCP Segments (1791 bytes): #69(1440), #70(351)]
Transport Layer Security

No.     Time           Source                Destination           Protocol Length Info
     81 2.226234       46.105.132.157        192.168.1.23          TCP      66     443 → 51810 [ACK] Seq=1 Ack=1792 Win=64128 Len=0 TSval=2608476669 TSecr=1359914141

Frame 81: 66 bytes on wire (528 bits), 66 bytes captured (528 bits)
Ethernet II, Src: SagemcomBroa_35:92:33 (38:35:fb:35:92:33), Dst: AzureWaveTec_50:78:a5 (b4:8c:9d:50:78:a5)
Internet Protocol Version 4, Src: 46.105.132.157, Dst: 192.168.1.23
Transmission Control Protocol, Src Port: 443, Dst Port: 51810, Seq: 1, Ack: 1792, Len: 0

No.     Time           Source                Destination           Protocol Length Info
     82 2.226312       46.105.132.157        192.168.1.23          TLSv1.3  1506   Server Hello, Change Cipher Spec, Application Data

Frame 82: 1506 bytes on wire (12048 bits), 1506 bytes captured (12048 bits)
Ethernet II, Src: SagemcomBroa_35:92:33 (38:35:fb:35:92:33), Dst: AzureWaveTec_50:78:a5 (b4:8c:9d:50:78:a5)
Internet Protocol Version 4, Src: 46.105.132.157, Dst: 192.168.1.23
Transmission Control Protocol, Src Port: 443, Dst Port: 51810, Seq: 1, Ack: 1792, Len: 1440
Transport Layer Security

No.     Time           Source                Destination           Protocol Length Info
     83 2.226329       192.168.1.23          46.105.132.157        TCP      66     51810 → 443 [ACK] Seq=1792 Ack=1441 Win=64128 Len=0 TSval=1359914170 TSecr=2608476669

Frame 83: 66 bytes on wire (528 bits), 66 bytes captured (528 bits)
Ethernet II, Src: AzureWaveTec_50:78:a5 (b4:8c:9d:50:78:a5), Dst: SagemcomBroa_35:92:33 (38:35:fb:35:92:33)
Internet Protocol Version 4, Src: 192.168.1.23, Dst: 46.105.132.157
Transmission Control Protocol, Src Port: 51810, Dst Port: 443, Seq: 1792, Ack: 1441, Len: 0

No.     Time           Source                Destination           Protocol Length Info
     84 2.226389       46.105.132.157        192.168.1.23          TCP      1506   443 → 51810 [PSH, ACK] Seq=1441 Ack=1792 Win=64128 Len=1440 TSval=2608476669 TSecr=1359914141 [TCP segment of a reassembled PDU]

Frame 84: 1506 bytes on wire (12048 bits), 1506 bytes captured (12048 bits)
Ethernet II, Src: SagemcomBroa_35:92:33 (38:35:fb:35:92:33), Dst: AzureWaveTec_50:78:a5 (b4:8c:9d:50:78:a5)
Internet Protocol Version 4, Src: 46.105.132.157, Dst: 192.168.1.23
Transmission Control Protocol, Src Port: 443, Dst Port: 51810, Seq: 1441, Ack: 1792, Len: 1440

No.     Time           Source                Destination           Protocol Length Info
     85 2.226394       192.168.1.23          46.105.132.157        TCP      66     51810 → 443 [ACK] Seq=1792 Ack=2881 Win=64128 Len=0 TSval=1359914170 TSecr=2608476669

Frame 85: 66 bytes on wire (528 bits), 66 bytes captured (528 bits)
Ethernet II, Src: AzureWaveTec_50:78:a5 (b4:8c:9d:50:78:a5), Dst: SagemcomBroa_35:92:33 (38:35:fb:35:92:33)
Internet Protocol Version 4, Src: 192.168.1.23, Dst: 46.105.132.157
Transmission Control Protocol, Src Port: 51810, Dst Port: 443, Seq: 1792, Ack: 2881, Len: 0

No.     Time           Source                Destination           Protocol Length Info
     86 2.226459       46.105.132.157        192.168.1.23          TCP      1282   443 → 51810 [PSH, ACK] Seq=2881 Ack=1792 Win=64128 Len=1216 TSval=2608476669 TSecr=1359914141 [TCP segment of a reassembled PDU]

Frame 86: 1282 bytes on wire (10256 bits), 1282 bytes captured (10256 bits)
Ethernet II, Src: SagemcomBroa_35:92:33 (38:35:fb:35:92:33), Dst: AzureWaveTec_50:78:a5 (b4:8c:9d:50:78:a5)
Internet Protocol Version 4, Src: 46.105.132.157, Dst: 192.168.1.23
Transmission Control Protocol, Src Port: 443, Dst Port: 51810, Seq: 2881, Ack: 1792, Len: 1216

No.     Time           Source                Destination           Protocol Length Info
     87 2.226464       192.168.1.23          46.105.132.157        TCP      66     51810 → 443 [ACK] Seq=1792 Ack=4097 Win=63232 Len=0 TSval=1359914170 TSecr=2608476669

Frame 87: 66 bytes on wire (528 bits), 66 bytes captured (528 bits)
Ethernet II, Src: AzureWaveTec_50:78:a5 (b4:8c:9d:50:78:a5), Dst: SagemcomBroa_35:92:33 (38:35:fb:35:92:33)
Internet Protocol Version 4, Src: 192.168.1.23, Dst: 46.105.132.157
Transmission Control Protocol, Src Port: 51810, Dst Port: 443, Seq: 1792, Ack: 4097, Len: 0

No.     Time           Source                Destination           Protocol Length Info
     90 2.226603       46.105.132.157        192.168.1.23          TCP      1506   443 → 51810 [ACK] Seq=4097 Ack=1792 Win=64128 Len=1440 TSval=2608476670 TSecr=1359914141 [TCP segment of a reassembled PDU]

Frame 90: 1506 bytes on wire (12048 bits), 1506 bytes captured (12048 bits)
Ethernet II, Src: SagemcomBroa_35:92:33 (38:35:fb:35:92:33), Dst: AzureWaveTec_50:78:a5 (b4:8c:9d:50:78:a5)
Internet Protocol Version 4, Src: 46.105.132.157, Dst: 192.168.1.23
Transmission Control Protocol, Src Port: 443, Dst Port: 51810, Seq: 4097, Ack: 1792, Len: 1440

No.     Time           Source                Destination           Protocol Length Info
     91 2.226607       192.168.1.23          46.105.132.157        TCP      66     51810 → 443 [ACK] Seq=1792 Ack=5537 Win=64128 Len=0 TSval=1359914170 TSecr=2608476670

Frame 91: 66 bytes on wire (528 bits), 66 bytes captured (528 bits)
Ethernet II, Src: AzureWaveTec_50:78:a5 (b4:8c:9d:50:78:a5), Dst: SagemcomBroa_35:92:33 (38:35:fb:35:92:33)
Internet Protocol Version 4, Src: 192.168.1.23, Dst: 46.105.132.157
Transmission Control Protocol, Src Port: 51810, Dst Port: 443, Seq: 1792, Ack: 5537, Len: 0

No.     Time           Source                Destination           Protocol Length Info
     92 2.226656       46.105.132.157        192.168.1.23          TLSv1.3  1041   Application Data, Application Data, Application Data

Frame 92: 1041 bytes on wire (8328 bits), 1041 bytes captured (8328 bits)
Ethernet II, Src: SagemcomBroa_35:92:33 (38:35:fb:35:92:33), Dst: AzureWaveTec_50:78:a5 (b4:8c:9d:50:78:a5)
Internet Protocol Version 4, Src: 46.105.132.157, Dst: 192.168.1.23
Transmission Control Protocol, Src Port: 443, Dst Port: 51810, Seq: 5537, Ack: 1792, Len: 975
[5 Reassembled TCP Segments (5993 bytes): #82(1266), #84(1440), #86(1216), #90(1440), #92(631)]
Transport Layer Security
Transport Layer Security

No.     Time           Source                Destination           Protocol Length Info
     93 2.226662       192.168.1.23          46.105.132.157        TCP      66     51810 → 443 [ACK] Seq=1792 Ack=6512 Win=63232 Len=0 TSval=1359914170 TSecr=2608476670

Frame 93: 66 bytes on wire (528 bits), 66 bytes captured (528 bits)
Ethernet II, Src: AzureWaveTec_50:78:a5 (b4:8c:9d:50:78:a5), Dst: SagemcomBroa_35:92:33 (38:35:fb:35:92:33)
Internet Protocol Version 4, Src: 192.168.1.23, Dst: 46.105.132.157
Transmission Control Protocol, Src Port: 51810, Dst Port: 443, Seq: 1792, Ack: 6512, Len: 0

No.     Time           Source                Destination           Protocol Length Info
    105 2.230895       192.168.1.23          46.105.132.157        TLSv1.3  130    Change Cipher Spec, Application Data

Frame 105: 130 bytes on wire (1040 bits), 130 bytes captured (1040 bits)
Ethernet II, Src: AzureWaveTec_50:78:a5 (b4:8c:9d:50:78:a5), Dst: SagemcomBroa_35:92:33 (38:35:fb:35:92:33)
Internet Protocol Version 4, Src: 192.168.1.23, Dst: 46.105.132.157
Transmission Control Protocol, Src Port: 51810, Dst Port: 443, Seq: 1792, Ack: 6512, Len: 64
Transport Layer Security

No.     Time           Source                Destination           Protocol Length Info
    106 2.231141       192.168.1.23          46.105.132.157        TLSv1.3  158    Application Data

Frame 106: 158 bytes on wire (1264 bits), 158 bytes captured (1264 bits)
Ethernet II, Src: AzureWaveTec_50:78:a5 (b4:8c:9d:50:78:a5), Dst: SagemcomBroa_35:92:33 (38:35:fb:35:92:33)
Internet Protocol Version 4, Src: 192.168.1.23, Dst: 46.105.132.157
Transmission Control Protocol, Src Port: 51810, Dst Port: 443, Seq: 1856, Ack: 6512, Len: 92
Transport Layer Security

No.     Time           Source                Destination           Protocol Length Info
    107 2.231388       192.168.1.23          46.105.132.157        TCP      1506   51810 → 443 [ACK] Seq=1948 Ack=6512 Win=64128 Len=1440 TSval=1359914175 TSecr=2608476670 [TCP segment of a reassembled PDU]

Frame 107: 1506 bytes on wire (12048 bits), 1506 bytes captured (12048 bits)
Ethernet II, Src: AzureWaveTec_50:78:a5 (b4:8c:9d:50:78:a5), Dst: SagemcomBroa_35:92:33 (38:35:fb:35:92:33)
Internet Protocol Version 4, Src: 192.168.1.23, Dst: 46.105.132.157
Transmission Control Protocol, Src Port: 51810, Dst Port: 443, Seq: 1948, Ack: 6512, Len: 1440

No.     Time           Source                Destination           Protocol Length Info
    108 2.231391       192.168.1.23          46.105.132.157        TLSv1.3  330    Application Data

Frame 108: 330 bytes on wire (2640 bits), 330 bytes captured (2640 bits)
Ethernet II, Src: AzureWaveTec_50:78:a5 (b4:8c:9d:50:78:a5), Dst: SagemcomBroa_35:92:33 (38:35:fb:35:92:33)
Internet Protocol Version 4, Src: 192.168.1.23, Dst: 46.105.132.157
Transmission Control Protocol, Src Port: 51810, Dst Port: 443, Seq: 3388, Ack: 6512, Len: 264
[2 Reassembled TCP Segments (1704 bytes): #107(1440), #108(264)]
Transport Layer Security

No.     Time           Source                Destination           Protocol Length Info
    114 2.250697       46.105.132.157        192.168.1.23          TLSv1.3  145    Application Data

Frame 114: 145 bytes on wire (1160 bits), 145 bytes captured (1160 bits)
Ethernet II, Src: SagemcomBroa_35:92:33 (38:35:fb:35:92:33), Dst: AzureWaveTec_50:78:a5 (b4:8c:9d:50:78:a5)
Internet Protocol Version 4, Src: 46.105.132.157, Dst: 192.168.1.23
Transmission Control Protocol, Src Port: 443, Dst Port: 51810, Seq: 6512, Ack: 1856, Len: 79
Transport Layer Security

No.     Time           Source                Destination           Protocol Length Info
    115 2.250903       46.105.132.157        192.168.1.23          TLSv1.3  145    Application Data

Frame 115: 145 bytes on wire (1160 bits), 145 bytes captured (1160 bits)
Ethernet II, Src: SagemcomBroa_35:92:33 (38:35:fb:35:92:33), Dst: AzureWaveTec_50:78:a5 (b4:8c:9d:50:78:a5)
Internet Protocol Version 4, Src: 46.105.132.157, Dst: 192.168.1.23
Transmission Control Protocol, Src Port: 443, Dst Port: 51810, Seq: 6591, Ack: 1856, Len: 79
Transport Layer Security

No.     Time           Source                Destination           Protocol Length Info
    116 2.250916       46.105.132.157        192.168.1.23          TLSv1.3  130    Application Data

Frame 116: 130 bytes on wire (1040 bits), 130 bytes captured (1040 bits)
Ethernet II, Src: SagemcomBroa_35:92:33 (38:35:fb:35:92:33), Dst: AzureWaveTec_50:78:a5 (b4:8c:9d:50:78:a5)
Internet Protocol Version 4, Src: 46.105.132.157, Dst: 192.168.1.23
Transmission Control Protocol, Src Port: 443, Dst Port: 51810, Seq: 6670, Ack: 1948, Len: 64
Transport Layer Security

No.     Time           Source                Destination           Protocol Length Info
    118 2.250943       192.168.1.23          46.105.132.157        TCP      66     51810 → 443 [ACK] Seq=3652 Ack=6734 Win=64128 Len=0 TSval=1359914195 TSecr=2608476705

Frame 118: 66 bytes on wire (528 bits), 66 bytes captured (528 bits)
Ethernet II, Src: AzureWaveTec_50:78:a5 (b4:8c:9d:50:78:a5), Dst: SagemcomBroa_35:92:33 (38:35:fb:35:92:33)
Internet Protocol Version 4, Src: 192.168.1.23, Dst: 46.105.132.157
Transmission Control Protocol, Src Port: 51810, Dst Port: 443, Seq: 3652, Ack: 6734, Len: 0

No.     Time           Source                Destination           Protocol Length Info
    119 2.251037       192.168.1.23          46.105.132.157        TLSv1.3  97     Application Data

Frame 119: 97 bytes on wire (776 bits), 97 bytes captured (776 bits)
Ethernet II, Src: AzureWaveTec_50:78:a5 (b4:8c:9d:50:78:a5), Dst: SagemcomBroa_35:92:33 (38:35:fb:35:92:33)
Internet Protocol Version 4, Src: 192.168.1.23, Dst: 46.105.132.157
Transmission Control Protocol, Src Port: 51810, Dst Port: 443, Seq: 3652, Ack: 6734, Len: 31
Transport Layer Security

No.     Time           Source                Destination           Protocol Length Info
    121 2.251940       46.105.132.157        192.168.1.23          TCP      66     443 → 51810 [ACK] Seq=6734 Ack=3652 Win=64128 Len=0 TSval=2608476708 TSecr=1359914175

Frame 121: 66 bytes on wire (528 bits), 66 bytes captured (528 bits)
Ethernet II, Src: SagemcomBroa_35:92:33 (38:35:fb:35:92:33), Dst: AzureWaveTec_50:78:a5 (b4:8c:9d:50:78:a5)
Internet Protocol Version 4, Src: 46.105.132.157, Dst: 192.168.1.23
Transmission Control Protocol, Src Port: 443, Dst Port: 51810, Seq: 6734, Ack: 3652, Len: 0

No.     Time           Source                Destination           Protocol Length Info
    130 2.286265       46.105.132.157        192.168.1.23          TLSv1.3  1252   Application Data

Frame 130: 1252 bytes on wire (10016 bits), 1252 bytes captured (10016 bits)
Ethernet II, Src: SagemcomBroa_35:92:33 (38:35:fb:35:92:33), Dst: AzureWaveTec_50:78:a5 (b4:8c:9d:50:78:a5)
Internet Protocol Version 4, Src: 46.105.132.157, Dst: 192.168.1.23
Transmission Control Protocol, Src Port: 443, Dst Port: 51810, Seq: 6734, Ack: 3683, Len: 1186
Transport Layer Security

No.     Time           Source                Destination           Protocol Length Info
    131 2.295912       192.168.1.23          46.105.132.157        TLSv1.3  292    Application Data

Frame 131: 292 bytes on wire (2336 bits), 292 bytes captured (2336 bits)
Ethernet II, Src: AzureWaveTec_50:78:a5 (b4:8c:9d:50:78:a5), Dst: SagemcomBroa_35:92:33 (38:35:fb:35:92:33)
Internet Protocol Version 4, Src: 192.168.1.23, Dst: 46.105.132.157
Transmission Control Protocol, Src Port: 51810, Dst Port: 443, Seq: 3683, Ack: 7920, Len: 226
Transport Layer Security

No.     Time           Source                Destination           Protocol Length Info
    133 2.346272       46.105.132.157        192.168.1.23          TLSv1.3  1014   Application Data

Frame 133: 1014 bytes on wire (8112 bits), 1014 bytes captured (8112 bits)
Ethernet II, Src: SagemcomBroa_35:92:33 (38:35:fb:35:92:33), Dst: AzureWaveTec_50:78:a5 (b4:8c:9d:50:78:a5)
Internet Protocol Version 4, Src: 46.105.132.157, Dst: 192.168.1.23
Transmission Control Protocol, Src Port: 443, Dst Port: 51810, Seq: 7920, Ack: 3909, Len: 948
Transport Layer Security

No.     Time           Source                Destination           Protocol Length Info
    134 2.351633       192.168.1.23          46.105.132.157        TLSv1.3  151    Application Data

Frame 134: 151 bytes on wire (1208 bits), 151 bytes captured (1208 bits)
Ethernet II, Src: AzureWaveTec_50:78:a5 (b4:8c:9d:50:78:a5), Dst: SagemcomBroa_35:92:33 (38:35:fb:35:92:33)
Internet Protocol Version 4, Src: 192.168.1.23, Dst: 46.105.132.157
Transmission Control Protocol, Src Port: 51810, Dst Port: 443, Seq: 3909, Ack: 8868, Len: 85
Transport Layer Security

No.     Time           Source                Destination           Protocol Length Info
    135 2.410653       46.105.132.157        192.168.1.23          TLSv1.3  1298   Application Data

Frame 135: 1298 bytes on wire (10384 bits), 1298 bytes captured (10384 bits)
Ethernet II, Src: SagemcomBroa_35:92:33 (38:35:fb:35:92:33), Dst: AzureWaveTec_50:78:a5 (b4:8c:9d:50:78:a5)
Internet Protocol Version 4, Src: 46.105.132.157, Dst: 192.168.1.23
Transmission Control Protocol, Src Port: 443, Dst Port: 51810, Seq: 8868, Ack: 3994, Len: 1232
Transport Layer Security

No.     Time           Source                Destination           Protocol Length Info
    141 2.451954       192.168.1.23          46.105.132.157        TCP      66     51810 → 443 [ACK] Seq=3994 Ack=10100 Win=64128 Len=0 TSval=1359914396 TSecr=2608476866

Frame 141: 66 bytes on wire (528 bits), 66 bytes captured (528 bits)
Ethernet II, Src: AzureWaveTec_50:78:a5 (b4:8c:9d:50:78:a5), Dst: SagemcomBroa_35:92:33 (38:35:fb:35:92:33)
Internet Protocol Version 4, Src: 192.168.1.23, Dst: 46.105.132.157
Transmission Control Protocol, Src Port: 51810, Dst Port: 443, Seq: 3994, Ack: 10100, Len: 0

No.     Time           Source                Destination           Protocol Length Info
    336 4.563199       192.168.1.23          46.105.132.157        TLSv1.3  286    Application Data

Frame 336: 286 bytes on wire (2288 bits), 286 bytes captured (2288 bits)
Ethernet II, Src: AzureWaveTec_50:78:a5 (b4:8c:9d:50:78:a5), Dst: SagemcomBroa_35:92:33 (38:35:fb:35:92:33)
Internet Protocol Version 4, Src: 192.168.1.23, Dst: 46.105.132.157
Transmission Control Protocol, Src Port: 51810, Dst Port: 443, Seq: 3994, Ack: 10100, Len: 220
Transport Layer Security

No.     Time           Source                Destination           Protocol Length Info
    346 4.618750       46.105.132.157        192.168.1.23          TCP      66     443 → 51810 [ACK] Seq=10100 Ack=4214 Win=64128 Len=0 TSval=2608479074 TSecr=1359916507

Frame 346: 66 bytes on wire (528 bits), 66 bytes captured (528 bits)
Ethernet II, Src: SagemcomBroa_35:92:33 (38:35:fb:35:92:33), Dst: AzureWaveTec_50:78:a5 (b4:8c:9d:50:78:a5)
Internet Protocol Version 4, Src: 46.105.132.157, Dst: 192.168.1.23
Transmission Control Protocol, Src Port: 443, Dst Port: 51810, Seq: 10100, Ack: 4214, Len: 0

No.     Time           Source                Destination           Protocol Length Info
    348 5.177973       46.105.132.157        192.168.1.23          TLSv1.3  947    Application Data

Frame 348: 947 bytes on wire (7576 bits), 947 bytes captured (7576 bits)
Ethernet II, Src: SagemcomBroa_35:92:33 (38:35:fb:35:92:33), Dst: AzureWaveTec_50:78:a5 (b4:8c:9d:50:78:a5)
Internet Protocol Version 4, Src: 46.105.132.157, Dst: 192.168.1.23
Transmission Control Protocol, Src Port: 443, Dst Port: 51810, Seq: 10100, Ack: 4214, Len: 881
Transport Layer Security

No.     Time           Source                Destination           Protocol Length Info
    349 5.177996       192.168.1.23          46.105.132.157        TCP      66     51810 → 443 [ACK] Seq=4214 Ack=10981 Win=64128 Len=0 TSval=1359917122 TSecr=2608479633

Frame 349: 66 bytes on wire (528 bits), 66 bytes captured (528 bits)
Ethernet II, Src: AzureWaveTec_50:78:a5 (b4:8c:9d:50:78:a5), Dst: SagemcomBroa_35:92:33 (38:35:fb:35:92:33)
Internet Protocol Version 4, Src: 192.168.1.23, Dst: 46.105.132.157
Transmission Control Protocol, Src Port: 51810, Dst Port: 443, Seq: 4214, Ack: 10981, Len: 0

No.     Time           Source                Destination           Protocol Length Info
    352 5.184961       192.168.1.23          46.105.132.157        TLSv1.3  166    Application Data

Frame 352: 166 bytes on wire (1328 bits), 166 bytes captured (1328 bits)
Ethernet II, Src: AzureWaveTec_50:78:a5 (b4:8c:9d:50:78:a5), Dst: SagemcomBroa_35:92:33 (38:35:fb:35:92:33)
Internet Protocol Version 4, Src: 192.168.1.23, Dst: 46.105.132.157
Transmission Control Protocol, Src Port: 51810, Dst Port: 443, Seq: 4214, Ack: 10981, Len: 100
Transport Layer Security

No.     Time           Source                Destination           Protocol Length Info
    353 5.198660       46.105.132.157        192.168.1.23          TCP      66     443 → 51810 [ACK] Seq=10981 Ack=4314 Win=64128 Len=0 TSval=2608479654 TSecr=1359917129

Frame 353: 66 bytes on wire (528 bits), 66 bytes captured (528 bits)
Ethernet II, Src: SagemcomBroa_35:92:33 (38:35:fb:35:92:33), Dst: AzureWaveTec_50:78:a5 (b4:8c:9d:50:78:a5)
Internet Protocol Version 4, Src: 46.105.132.157, Dst: 192.168.1.23
Transmission Control Protocol, Src Port: 443, Dst Port: 51810, Seq: 10981, Ack: 4314, Len: 0

No.     Time           Source                Destination           Protocol Length Info
    354 5.250828       46.105.132.157        192.168.1.23          TLSv1.3  922    Application Data

Frame 354: 922 bytes on wire (7376 bits), 922 bytes captured (7376 bits)
Ethernet II, Src: SagemcomBroa_35:92:33 (38:35:fb:35:92:33), Dst: AzureWaveTec_50:78:a5 (b4:8c:9d:50:78:a5)
Internet Protocol Version 4, Src: 46.105.132.157, Dst: 192.168.1.23
Transmission Control Protocol, Src Port: 443, Dst Port: 51810, Seq: 10981, Ack: 4314, Len: 856
Transport Layer Security

No.     Time           Source                Destination           Protocol Length Info
    355 5.258113       192.168.1.23          46.105.132.157        TLSv1.3  145    Application Data

Frame 355: 145 bytes on wire (1160 bits), 145 bytes captured (1160 bits)
Ethernet II, Src: AzureWaveTec_50:78:a5 (b4:8c:9d:50:78:a5), Dst: SagemcomBroa_35:92:33 (38:35:fb:35:92:33)
Internet Protocol Version 4, Src: 192.168.1.23, Dst: 46.105.132.157
Transmission Control Protocol, Src Port: 51810, Dst Port: 443, Seq: 4314, Ack: 11837, Len: 79
Transport Layer Security

No.     Time           Source                Destination           Protocol Length Info
    357 5.272211       46.105.132.157        192.168.1.23          TCP      66     443 → 51810 [ACK] Seq=11837 Ack=4393 Win=64128 Len=0 TSval=2608479727 TSecr=1359917202

Frame 357: 66 bytes on wire (528 bits), 66 bytes captured (528 bits)
Ethernet II, Src: SagemcomBroa_35:92:33 (38:35:fb:35:92:33), Dst: AzureWaveTec_50:78:a5 (b4:8c:9d:50:78:a5)
Internet Protocol Version 4, Src: 46.105.132.157, Dst: 192.168.1.23
Transmission Control Protocol, Src Port: 443, Dst Port: 51810, Seq: 11837, Ack: 4393, Len: 0

No.     Time           Source                Destination           Protocol Length Info
    361 5.401867       46.105.132.157        192.168.1.23          TCP      2946   443 → 51810 [PSH, ACK] Seq=11837 Ack=4393 Win=64128 Len=2880 TSval=2608479854 TSecr=1359917202 [TCP segment of a reassembled PDU]

Frame 361: 2946 bytes on wire (23568 bits), 2946 bytes captured (23568 bits)
Ethernet II, Src: SagemcomBroa_35:92:33 (38:35:fb:35:92:33), Dst: AzureWaveTec_50:78:a5 (b4:8c:9d:50:78:a5)
Internet Protocol Version 4, Src: 46.105.132.157, Dst: 192.168.1.23
Transmission Control Protocol, Src Port: 443, Dst Port: 51810, Seq: 11837, Ack: 4393, Len: 2880

No.     Time           Source                Destination           Protocol Length Info
    362 5.401895       46.105.132.157        192.168.1.23          TCP      2946   443 → 51810 [PSH, ACK] Seq=14717 Ack=4393 Win=64128 Len=2880 TSval=2608479854 TSecr=1359917202 [TCP segment of a reassembled PDU]

Frame 362: 2946 bytes on wire (23568 bits), 2946 bytes captured (23568 bits)
Ethernet II, Src: SagemcomBroa_35:92:33 (38:35:fb:35:92:33), Dst: AzureWaveTec_50:78:a5 (b4:8c:9d:50:78:a5)
Internet Protocol Version 4, Src: 46.105.132.157, Dst: 192.168.1.23
Transmission Control Protocol, Src Port: 443, Dst Port: 51810, Seq: 14717, Ack: 4393, Len: 2880

No.     Time           Source                Destination           Protocol Length Info
    363 5.401899       46.105.132.157        192.168.1.23          TCP      2946   443 → 51810 [PSH, ACK] Seq=17597 Ack=4393 Win=64128 Len=2880 TSval=2608479854 TSecr=1359917202 [TCP segment of a reassembled PDU]

Frame 363: 2946 bytes on wire (23568 bits), 2946 bytes captured (23568 bits)
Ethernet II, Src: SagemcomBroa_35:92:33 (38:35:fb:35:92:33), Dst: AzureWaveTec_50:78:a5 (b4:8c:9d:50:78:a5)
Internet Protocol Version 4, Src: 46.105.132.157, Dst: 192.168.1.23
Transmission Control Protocol, Src Port: 443, Dst Port: 51810, Seq: 17597, Ack: 4393, Len: 2880

No.     Time           Source                Destination           Protocol Length Info
    364 5.401901       46.105.132.157        192.168.1.23          TCP      1506   443 → 51810 [ACK] Seq=20477 Ack=4393 Win=64128 Len=1440 TSval=2608479854 TSecr=1359917202 [TCP segment of a reassembled PDU]

Frame 364: 1506 bytes on wire (12048 bits), 1506 bytes captured (12048 bits)
Ethernet II, Src: SagemcomBroa_35:92:33 (38:35:fb:35:92:33), Dst: AzureWaveTec_50:78:a5 (b4:8c:9d:50:78:a5)
Internet Protocol Version 4, Src: 46.105.132.157, Dst: 192.168.1.23
Transmission Control Protocol, Src Port: 443, Dst Port: 51810, Seq: 20477, Ack: 4393, Len: 1440

No.     Time           Source                Destination           Protocol Length Info
    365 5.402034       192.168.1.23          46.105.132.157        TCP      66     51810 → 443 [ACK] Seq=4393 Ack=21917 Win=64128 Len=0 TSval=1359917346 TSecr=2608479854

Frame 365: 66 bytes on wire (528 bits), 66 bytes captured (528 bits)
Ethernet II, Src: AzureWaveTec_50:78:a5 (b4:8c:9d:50:78:a5), Dst: SagemcomBroa_35:92:33 (38:35:fb:35:92:33)
Internet Protocol Version 4, Src: 192.168.1.23, Dst: 46.105.132.157
Transmission Control Protocol, Src Port: 51810, Dst Port: 443, Seq: 4393, Ack: 21917, Len: 0

No.     Time           Source                Destination           Protocol Length Info
    366 5.402189       46.105.132.157        192.168.1.23          TCP      1506   443 → 51810 [PSH, ACK] Seq=21917 Ack=4393 Win=64128 Len=1440 TSval=2608479854 TSecr=1359917202 [TCP segment of a reassembled PDU]

Frame 366: 1506 bytes on wire (12048 bits), 1506 bytes captured (12048 bits)
Ethernet II, Src: SagemcomBroa_35:92:33 (38:35:fb:35:92:33), Dst: AzureWaveTec_50:78:a5 (b4:8c:9d:50:78:a5)
Internet Protocol Version 4, Src: 46.105.132.157, Dst: 192.168.1.23
Transmission Control Protocol, Src Port: 443, Dst Port: 51810, Seq: 21917, Ack: 4393, Len: 1440

No.     Time           Source                Destination           Protocol Length Info
    367 5.403158       46.105.132.157        192.168.1.23          TCP      1506   443 → 51810 [ACK] Seq=23357 Ack=4393 Win=64128 Len=1440 TSval=2608479854 TSecr=1359917202 [TCP segment of a reassembled PDU]

Frame 367: 1506 bytes on wire (12048 bits), 1506 bytes captured (12048 bits)
Ethernet II, Src: SagemcomBroa_35:92:33 (38:35:fb:35:92:33), Dst: AzureWaveTec_50:78:a5 (b4:8c:9d:50:78:a5)
Internet Protocol Version 4, Src: 46.105.132.157, Dst: 192.168.1.23
Transmission Control Protocol, Src Port: 443, Dst Port: 51810, Seq: 23357, Ack: 4393, Len: 1440

No.     Time           Source                Destination           Protocol Length Info
    368 5.403189       192.168.1.23          46.105.132.157        TCP      66     51810 → 443 [ACK] Seq=4393 Ack=24797 Win=64128 Len=0 TSval=1359917347 TSecr=2608479854

Frame 368: 66 bytes on wire (528 bits), 66 bytes captured (528 bits)
Ethernet II, Src: AzureWaveTec_50:78:a5 (b4:8c:9d:50:78:a5), Dst: SagemcomBroa_35:92:33 (38:35:fb:35:92:33)
Internet Protocol Version 4, Src: 192.168.1.23, Dst: 46.105.132.157
Transmission Control Protocol, Src Port: 51810, Dst Port: 443, Seq: 4393, Ack: 24797, Len: 0

No.     Time           Source                Destination           Protocol Length Info
    369 5.403672       46.105.132.157        192.168.1.23          TCP      1506   443 → 51810 [PSH, ACK] Seq=24797 Ack=4393 Win=64128 Len=1440 TSval=2608479854 TSecr=1359917202 [TCP segment of a reassembled PDU]

Frame 369: 1506 bytes on wire (12048 bits), 1506 bytes captured (12048 bits)
Ethernet II, Src: SagemcomBroa_35:92:33 (38:35:fb:35:92:33), Dst: AzureWaveTec_50:78:a5 (b4:8c:9d:50:78:a5)
Internet Protocol Version 4, Src: 46.105.132.157, Dst: 192.168.1.23
Transmission Control Protocol, Src Port: 443, Dst Port: 51810, Seq: 24797, Ack: 4393, Len: 1440

No.     Time           Source                Destination           Protocol Length Info
    370 5.417253       46.105.132.157        192.168.1.23          TLSv1.3  1264   Application Data

Frame 370: 1264 bytes on wire (10112 bits), 1264 bytes captured (10112 bits)
Ethernet II, Src: SagemcomBroa_35:92:33 (38:35:fb:35:92:33), Dst: AzureWaveTec_50:78:a5 (b4:8c:9d:50:78:a5)
Internet Protocol Version 4, Src: 46.105.132.157, Dst: 192.168.1.23
Transmission Control Protocol, Src Port: 443, Dst Port: 51810, Seq: 26237, Ack: 4393, Len: 1198
[8 Reassembled TCP Segments (15598 bytes): #361(2880), #362(2880), #363(2880), #364(1440), #366(1440), #367(1440), #369(1440), #370(1198)]
Transport Layer Security

No.     Time           Source                Destination           Protocol Length Info
    371 5.417282       192.168.1.23          46.105.132.157        TCP      66     51810 → 443 [ACK] Seq=4393 Ack=27435 Win=64128 Len=0 TSval=1359917361 TSecr=2608479854

Frame 371: 66 bytes on wire (528 bits), 66 bytes captured (528 bits)
Ethernet II, Src: AzureWaveTec_50:78:a5 (b4:8c:9d:50:78:a5), Dst: SagemcomBroa_35:92:33 (38:35:fb:35:92:33)
Internet Protocol Version 4, Src: 192.168.1.23, Dst: 46.105.132.157
Transmission Control Protocol, Src Port: 51810, Dst Port: 443, Seq: 4393, Ack: 27435, Len: 0

No.     Time           Source                Destination           Protocol Length Info
    392 7.203007       192.168.1.23          46.105.132.157        TLSv1.3  303    Application Data

Frame 392: 303 bytes on wire (2424 bits), 303 bytes captured (2424 bits)
Ethernet II, Src: AzureWaveTec_50:78:a5 (b4:8c:9d:50:78:a5), Dst: SagemcomBroa_35:92:33 (38:35:fb:35:92:33)
Internet Protocol Version 4, Src: 192.168.1.23, Dst: 46.105.132.157
Transmission Control Protocol, Src Port: 51810, Dst Port: 443, Seq: 4393, Ack: 27435, Len: 237
Transport Layer Security

No.     Time           Source                Destination           Protocol Length Info
    393 7.272661       46.105.132.157        192.168.1.23          TCP      66     443 → 51810 [ACK] Seq=27435 Ack=4630 Win=64128 Len=0 TSval=2608481684 TSecr=1359919147

Frame 393: 66 bytes on wire (528 bits), 66 bytes captured (528 bits)
Ethernet II, Src: SagemcomBroa_35:92:33 (38:35:fb:35:92:33), Dst: AzureWaveTec_50:78:a5 (b4:8c:9d:50:78:a5)
Internet Protocol Version 4, Src: 46.105.132.157, Dst: 192.168.1.23
Transmission Control Protocol, Src Port: 443, Dst Port: 51810, Seq: 27435, Ack: 4630, Len: 0

No.     Time           Source                Destination           Protocol Length Info
    394 7.278781       46.105.132.157        192.168.1.23          TLSv1.3  1211   Application Data

Frame 394: 1211 bytes on wire (9688 bits), 1211 bytes captured (9688 bits)
Ethernet II, Src: SagemcomBroa_35:92:33 (38:35:fb:35:92:33), Dst: AzureWaveTec_50:78:a5 (b4:8c:9d:50:78:a5)
Internet Protocol Version 4, Src: 46.105.132.157, Dst: 192.168.1.23
Transmission Control Protocol, Src Port: 443, Dst Port: 51810, Seq: 27435, Ack: 4630, Len: 1145
Transport Layer Security

No.     Time           Source                Destination           Protocol Length Info
    395 7.281737       192.168.1.23          46.105.132.157        TLSv1.3  101    Application Data

Frame 395: 101 bytes on wire (808 bits), 101 bytes captured (808 bits)
Ethernet II, Src: AzureWaveTec_50:78:a5 (b4:8c:9d:50:78:a5), Dst: SagemcomBroa_35:92:33 (38:35:fb:35:92:33)
Internet Protocol Version 4, Src: 192.168.1.23, Dst: 46.105.132.157
Transmission Control Protocol, Src Port: 51810, Dst Port: 443, Seq: 4630, Ack: 28580, Len: 35
Transport Layer Security

No.     Time           Source                Destination           Protocol Length Info
    396 7.313147       46.105.132.157        192.168.1.23          TCP      66     443 → 51810 [ACK] Seq=28580 Ack=4665 Win=64128 Len=0 TSval=2608481768 TSecr=1359919225

Frame 396: 66 bytes on wire (528 bits), 66 bytes captured (528 bits)
Ethernet II, Src: SagemcomBroa_35:92:33 (38:35:fb:35:92:33), Dst: AzureWaveTec_50:78:a5 (b4:8c:9d:50:78:a5)
Internet Protocol Version 4, Src: 46.105.132.157, Dst: 192.168.1.23
Transmission Control Protocol, Src Port: 443, Dst Port: 51810, Seq: 28580, Ack: 4665, Len: 0

No.     Time           Source                Destination           Protocol Length Info
    397 9.492498       192.168.1.23          46.105.132.157        TLSv1.3  208    Application Data

Frame 397: 208 bytes on wire (1664 bits), 208 bytes captured (1664 bits)
Ethernet II, Src: AzureWaveTec_50:78:a5 (b4:8c:9d:50:78:a5), Dst: SagemcomBroa_35:92:33 (38:35:fb:35:92:33)
Internet Protocol Version 4, Src: 192.168.1.23, Dst: 46.105.132.157
Transmission Control Protocol, Src Port: 51810, Dst Port: 443, Seq: 4665, Ack: 28580, Len: 142
Transport Layer Security

No.     Time           Source                Destination           Protocol Length Info
    398 9.495644       192.168.1.23          46.105.132.157        TLSv1.3  164    Application Data

Frame 398: 164 bytes on wire (1312 bits), 164 bytes captured (1312 bits)
Ethernet II, Src: AzureWaveTec_50:78:a5 (b4:8c:9d:50:78:a5), Dst: SagemcomBroa_35:92:33 (38:35:fb:35:92:33)
Internet Protocol Version 4, Src: 192.168.1.23, Dst: 46.105.132.157
Transmission Control Protocol, Src Port: 51810, Dst Port: 443, Seq: 4807, Ack: 28580, Len: 98
Transport Layer Security

No.     Time           Source                Destination           Protocol Length Info
    399 9.504775       192.168.1.23          46.105.132.157        TLSv1.3  249    Application Data

Frame 399: 249 bytes on wire (1992 bits), 249 bytes captured (1992 bits)
Ethernet II, Src: AzureWaveTec_50:78:a5 (b4:8c:9d:50:78:a5), Dst: SagemcomBroa_35:92:33 (38:35:fb:35:92:33)
Internet Protocol Version 4, Src: 192.168.1.23, Dst: 46.105.132.157
Transmission Control Protocol, Src Port: 51810, Dst Port: 443, Seq: 4905, Ack: 28580, Len: 183
Transport Layer Security

No.     Time           Source                Destination           Protocol Length Info
    400 9.504854       192.168.1.23          46.105.132.157        TLSv1.3  801    Application Data

Frame 400: 801 bytes on wire (6408 bits), 801 bytes captured (6408 bits)
Ethernet II, Src: AzureWaveTec_50:78:a5 (b4:8c:9d:50:78:a5), Dst: SagemcomBroa_35:92:33 (38:35:fb:35:92:33)
Internet Protocol Version 4, Src: 192.168.1.23, Dst: 46.105.132.157
Transmission Control Protocol, Src Port: 51810, Dst Port: 443, Seq: 5088, Ack: 28580, Len: 735
Transport Layer Security

No.     Time           Source                Destination           Protocol Length Info
    401 9.508648       46.105.132.157        192.168.1.23          TCP      66     443 → 51810 [ACK] Seq=28580 Ack=4807 Win=64128 Len=0 TSval=2608483964 TSecr=1359921436

Frame 401: 66 bytes on wire (528 bits), 66 bytes captured (528 bits)
Ethernet II, Src: SagemcomBroa_35:92:33 (38:35:fb:35:92:33), Dst: AzureWaveTec_50:78:a5 (b4:8c:9d:50:78:a5)
Internet Protocol Version 4, Src: 46.105.132.157, Dst: 192.168.1.23
Transmission Control Protocol, Src Port: 443, Dst Port: 51810, Seq: 28580, Ack: 4807, Len: 0

No.     Time           Source                Destination           Protocol Length Info
    402 9.509050       46.105.132.157        192.168.1.23          TCP      66     443 → 51810 [ACK] Seq=28580 Ack=4905 Win=64128 Len=0 TSval=2608483964 TSecr=1359921439

Frame 402: 66 bytes on wire (528 bits), 66 bytes captured (528 bits)
Ethernet II, Src: SagemcomBroa_35:92:33 (38:35:fb:35:92:33), Dst: AzureWaveTec_50:78:a5 (b4:8c:9d:50:78:a5)
Internet Protocol Version 4, Src: 46.105.132.157, Dst: 192.168.1.23
Transmission Control Protocol, Src Port: 443, Dst Port: 51810, Seq: 28580, Ack: 4905, Len: 0

No.     Time           Source                Destination           Protocol Length Info
    403 9.521541       46.105.132.157        192.168.1.23          TCP      66     443 → 51810 [ACK] Seq=28580 Ack=5088 Win=64128 Len=0 TSval=2608483973 TSecr=1359921448

Frame 403: 66 bytes on wire (528 bits), 66 bytes captured (528 bits)
Ethernet II, Src: SagemcomBroa_35:92:33 (38:35:fb:35:92:33), Dst: AzureWaveTec_50:78:a5 (b4:8c:9d:50:78:a5)
Internet Protocol Version 4, Src: 46.105.132.157, Dst: 192.168.1.23
Transmission Control Protocol, Src Port: 443, Dst Port: 51810, Seq: 28580, Ack: 5088, Len: 0

No.     Time           Source                Destination           Protocol Length Info
    404 9.521690       46.105.132.157        192.168.1.23          TCP      66     443 → 51810 [ACK] Seq=28580 Ack=5823 Win=64128 Len=0 TSval=2608483975 TSecr=1359921449

Frame 404: 66 bytes on wire (528 bits), 66 bytes captured (528 bits)
Ethernet II, Src: SagemcomBroa_35:92:33 (38:35:fb:35:92:33), Dst: AzureWaveTec_50:78:a5 (b4:8c:9d:50:78:a5)
Internet Protocol Version 4, Src: 46.105.132.157, Dst: 192.168.1.23
Transmission Control Protocol, Src Port: 443, Dst Port: 51810, Seq: 28580, Ack: 5823, Len: 0

No.     Time           Source                Destination           Protocol Length Info
    405 9.521697       46.105.132.157        192.168.1.23          TLSv1.3  114    Application Data

Frame 405: 114 bytes on wire (912 bits), 114 bytes captured (912 bits)
Ethernet II, Src: SagemcomBroa_35:92:33 (38:35:fb:35:92:33), Dst: AzureWaveTec_50:78:a5 (b4:8c:9d:50:78:a5)
Internet Protocol Version 4, Src: 46.105.132.157, Dst: 192.168.1.23
Transmission Control Protocol, Src Port: 443, Dst Port: 51810, Seq: 28580, Ack: 5823, Len: 48
Transport Layer Security

