No.     Time           Source                Destination           Protocol Length Info
      3 2.190543       192.168.1.23          192.168.1.1           DNS      89     Standard query 0x3999 HTTPS clientservices.googleapis.com

Frame 3: 89 bytes on wire (712 bits), 89 bytes captured (712 bits)
Ethernet II, Src: AzureWaveTec_50:78:a5 (b4:8c:9d:50:78:a5), Dst: SagemcomBroa_35:92:33 (38:35:fb:35:92:33)
Internet Protocol Version 4, Src: 192.168.1.23 (192.168.1.23), Dst: 192.168.1.1 (192.168.1.1)
User Datagram Protocol, Src Port: 32922 (32922), Dst Port: domain (53)
Domain Name System (query)

No.     Time           Source                Destination           Protocol Length Info
      4 2.193924       192.168.1.23          192.168.1.1           DNS      79     Standard query 0x613f HTTPS accounts.google.com

Frame 4: 79 bytes on wire (632 bits), 79 bytes captured (632 bits)
Ethernet II, Src: AzureWaveTec_50:78:a5 (b4:8c:9d:50:78:a5), Dst: SagemcomBroa_35:92:33 (38:35:fb:35:92:33)
Internet Protocol Version 4, Src: 192.168.1.23 (192.168.1.23), Dst: 192.168.1.1 (192.168.1.1)
User Datagram Protocol, Src Port: 34115 (34115), Dst Port: domain (53)
Domain Name System (query)

No.     Time           Source                Destination           Protocol Length Info
      8 2.207456       192.168.1.1           192.168.1.23          DNS      146    Standard query response 0x3999 HTTPS clientservices.googleapis.com SOA ns1.google.com

Frame 8: 146 bytes on wire (1168 bits), 146 bytes captured (1168 bits)
Ethernet II, Src: SagemcomBroa_35:92:33 (38:35:fb:35:92:33), Dst: AzureWaveTec_50:78:a5 (b4:8c:9d:50:78:a5)
Internet Protocol Version 4, Src: 192.168.1.1 (192.168.1.1), Dst: 192.168.1.23 (192.168.1.23)
User Datagram Protocol, Src Port: domain (53), Dst Port: 32922 (32922)
Domain Name System (response)

No.     Time           Source                Destination           Protocol Length Info
      9 2.210728       192.168.1.1           192.168.1.23          DNS      129    Standard query response 0x613f HTTPS accounts.google.com SOA ns1.google.com

Frame 9: 129 bytes on wire (1032 bits), 129 bytes captured (1032 bits)
Ethernet II, Src: SagemcomBroa_35:92:33 (38:35:fb:35:92:33), Dst: AzureWaveTec_50:78:a5 (b4:8c:9d:50:78:a5)
Internet Protocol Version 4, Src: 192.168.1.1 (192.168.1.1), Dst: 192.168.1.23 (192.168.1.23)
User Datagram Protocol, Src Port: domain (53), Dst Port: 34115 (34115)
Domain Name System (response)

No.     Time           Source                Destination           Protocol Length Info
     14 2.223316       192.168.1.23          192.168.1.1           DNS      77     Standard query 0x3408 AAAA drive.shadow.tech

Frame 14: 77 bytes on wire (616 bits), 77 bytes captured (616 bits)
Ethernet II, Src: AzureWaveTec_50:78:a5 (b4:8c:9d:50:78:a5), Dst: SagemcomBroa_35:92:33 (38:35:fb:35:92:33)
Internet Protocol Version 4, Src: 192.168.1.23 (192.168.1.23), Dst: 192.168.1.1 (192.168.1.1)
User Datagram Protocol, Src Port: 47674 (47674), Dst Port: domain (53)
Domain Name System (query)

No.     Time           Source                Destination           Protocol Length Info
     15 2.223425       192.168.1.23          192.168.1.1           DNS      77     Standard query 0x1d20 HTTPS drive.shadow.tech

Frame 15: 77 bytes on wire (616 bits), 77 bytes captured (616 bits)
Ethernet II, Src: AzureWaveTec_50:78:a5 (b4:8c:9d:50:78:a5), Dst: SagemcomBroa_35:92:33 (38:35:fb:35:92:33)
Internet Protocol Version 4, Src: 192.168.1.23 (192.168.1.23), Dst: 192.168.1.1 (192.168.1.1)
User Datagram Protocol, Src Port: 59088 (59088), Dst Port: domain (53)
Domain Name System (query)

No.     Time           Source                Destination           Protocol Length Info
     16 2.225312       192.168.1.1           192.168.1.23          DNS      77     Standard query response 0x3408 AAAA drive.shadow.tech

Frame 16: 77 bytes on wire (616 bits), 77 bytes captured (616 bits)
Ethernet II, Src: SagemcomBroa_35:92:33 (38:35:fb:35:92:33), Dst: AzureWaveTec_50:78:a5 (b4:8c:9d:50:78:a5)
Internet Protocol Version 4, Src: 192.168.1.1 (192.168.1.1), Dst: 192.168.1.23 (192.168.1.23)
User Datagram Protocol, Src Port: domain (53), Dst Port: 47674 (47674)
Domain Name System (response)

No.     Time           Source                Destination           Protocol Length Info
     17 2.226101       192.168.1.23          239.255.255.250       SSDP     214    M-SEARCH * HTTP/1.1 

Frame 17: 214 bytes on wire (1712 bits), 214 bytes captured (1712 bits)
Ethernet II, Src: AzureWaveTec_50:78:a5 (b4:8c:9d:50:78:a5), Dst: IPv4mcast_7f:ff:fa (01:00:5e:7f:ff:fa)
Internet Protocol Version 4, Src: 192.168.1.23 (192.168.1.23), Dst: 239.255.255.250 (239.255.255.250)
User Datagram Protocol, Src Port: 48059 (48059), Dst Port: ssdp (1900)
Simple Service Discovery Protocol

No.     Time           Source                Destination           Protocol Length Info
     19 2.231491       192.168.1.23          46.105.132.157        TCP      74     43340 → https(443) [SYN] Seq=0 Win=64240 Len=0 MSS=1460 SACK_PERM TSval=1359368687 TSecr=0 WS=128

Frame 19: 74 bytes on wire (592 bits), 74 bytes captured (592 bits)
Ethernet II, Src: AzureWaveTec_50:78:a5 (b4:8c:9d:50:78:a5), Dst: SagemcomBroa_35:92:33 (38:35:fb:35:92:33)
Internet Protocol Version 4, Src: 192.168.1.23 (192.168.1.23), Dst: 46.105.132.157 (46.105.132.157)
Transmission Control Protocol, Src Port: 43340 (43340), Dst Port: https (443), Seq: 0, Len: 0

No.     Time           Source                Destination           Protocol Length Info
     20 2.231566       192.168.1.64          192.168.1.23          SSDP     336    HTTP/1.1 200 OK 

Frame 20: 336 bytes on wire (2688 bits), 336 bytes captured (2688 bits)
Ethernet II, Src: CiscoSPVTG_56:6b:62 (38:5f:66:56:6b:62), Dst: AzureWaveTec_50:78:a5 (b4:8c:9d:50:78:a5)
Internet Protocol Version 4, Src: 192.168.1.64 (192.168.1.64), Dst: 192.168.1.23 (192.168.1.23)
User Datagram Protocol, Src Port: ssdp (1900), Dst Port: 48059 (48059)
Simple Service Discovery Protocol

No.     Time           Source                Destination           Protocol Length Info
     28 2.235912       192.168.1.65          192.168.1.23          SSDP     336    HTTP/1.1 200 OK 

Frame 28: 336 bytes on wire (2688 bits), 336 bytes captured (2688 bits)
Ethernet II, Src: CiscoSPVTG_53:08:83 (2c:ab:a4:53:08:83), Dst: AzureWaveTec_50:78:a5 (b4:8c:9d:50:78:a5)
Internet Protocol Version 4, Src: 192.168.1.65 (192.168.1.65), Dst: 192.168.1.23 (192.168.1.23)
User Datagram Protocol, Src Port: ssdp (1900), Dst Port: 48059 (48059)
Simple Service Discovery Protocol

No.     Time           Source                Destination           Protocol Length Info
     30 2.242251       192.168.1.1           192.168.1.23          DNS      140    Standard query response 0x1d20 HTTPS drive.shadow.tech SOA candy.ns.cloudflare.com

Frame 30: 140 bytes on wire (1120 bits), 140 bytes captured (1120 bits)
Ethernet II, Src: SagemcomBroa_35:92:33 (38:35:fb:35:92:33), Dst: AzureWaveTec_50:78:a5 (b4:8c:9d:50:78:a5)
Internet Protocol Version 4, Src: 192.168.1.1 (192.168.1.1), Dst: 192.168.1.23 (192.168.1.23)
User Datagram Protocol, Src Port: domain (53), Dst Port: 59088 (59088)
Domain Name System (response)

No.     Time           Source                Destination           Protocol Length Info
     34 2.249766       46.105.132.157        192.168.1.23          TCP      74     https(443) → 43340 [SYN, ACK] Seq=0 Ack=1 Win=65160 Len=0 MSS=1452 SACK_PERM TSval=2600847875 TSecr=1359368687 WS=128

Frame 34: 74 bytes on wire (592 bits), 74 bytes captured (592 bits)
Ethernet II, Src: SagemcomBroa_35:92:33 (38:35:fb:35:92:33), Dst: AzureWaveTec_50:78:a5 (b4:8c:9d:50:78:a5)
Internet Protocol Version 4, Src: 46.105.132.157 (46.105.132.157), Dst: 192.168.1.23 (192.168.1.23)
Transmission Control Protocol, Src Port: https (443), Dst Port: 43340 (43340), Seq: 0, Ack: 1, Len: 0

No.     Time           Source                Destination           Protocol Length Info
     35 2.249790       192.168.1.23          46.105.132.157        TCP      66     43340 → https(443) [ACK] Seq=1 Ack=1 Win=64256 Len=0 TSval=1359368705 TSecr=2600847875

Frame 35: 66 bytes on wire (528 bits), 66 bytes captured (528 bits)
Ethernet II, Src: AzureWaveTec_50:78:a5 (b4:8c:9d:50:78:a5), Dst: SagemcomBroa_35:92:33 (38:35:fb:35:92:33)
Internet Protocol Version 4, Src: 192.168.1.23 (192.168.1.23), Dst: 46.105.132.157 (46.105.132.157)
Transmission Control Protocol, Src Port: 43340 (43340), Dst Port: https (443), Seq: 1, Ack: 1, Len: 0

No.     Time           Source                Destination           Protocol Length Info
     36 2.250141       192.168.1.23          46.105.132.157        TCP      1506   43340 → https(443) [ACK] Seq=1 Ack=1 Win=64256 Len=1440 TSval=1359368705 TSecr=2600847875 [TCP segment of a reassembled PDU]

Frame 36: 1506 bytes on wire (12048 bits), 1506 bytes captured (12048 bits)
Ethernet II, Src: AzureWaveTec_50:78:a5 (b4:8c:9d:50:78:a5), Dst: SagemcomBroa_35:92:33 (38:35:fb:35:92:33)
Internet Protocol Version 4, Src: 192.168.1.23 (192.168.1.23), Dst: 46.105.132.157 (46.105.132.157)
Transmission Control Protocol, Src Port: 43340 (43340), Dst Port: https (443), Seq: 1, Ack: 1, Len: 1440

No.     Time           Source                Destination           Protocol Length Info
     37 2.250146       192.168.1.23          46.105.132.157        TLSv1.3  417    Client Hello (SNI=drive.shadow.tech)

Frame 37: 417 bytes on wire (3336 bits), 417 bytes captured (3336 bits)
Ethernet II, Src: AzureWaveTec_50:78:a5 (b4:8c:9d:50:78:a5), Dst: SagemcomBroa_35:92:33 (38:35:fb:35:92:33)
Internet Protocol Version 4, Src: 192.168.1.23 (192.168.1.23), Dst: 46.105.132.157 (46.105.132.157)
Transmission Control Protocol, Src Port: 43340 (43340), Dst Port: https (443), Seq: 1441, Ack: 1, Len: 351
[2 Reassembled TCP Segments (1791 bytes): #36(1440), #37(351)]
Transport Layer Security

No.     Time           Source                Destination           Protocol Length Info
     60 2.269758       46.105.132.157        192.168.1.23          TCP      66     https(443) → 43340 [ACK] Seq=1 Ack=1792 Win=64128 Len=0 TSval=2600847896 TSecr=1359368705

Frame 60: 66 bytes on wire (528 bits), 66 bytes captured (528 bits)
Ethernet II, Src: SagemcomBroa_35:92:33 (38:35:fb:35:92:33), Dst: AzureWaveTec_50:78:a5 (b4:8c:9d:50:78:a5)
Internet Protocol Version 4, Src: 46.105.132.157 (46.105.132.157), Dst: 192.168.1.23 (192.168.1.23)
Transmission Control Protocol, Src Port: https (443), Dst Port: 43340 (43340), Seq: 1, Ack: 1792, Len: 0

No.     Time           Source                Destination           Protocol Length Info
     61 2.269866       46.105.132.157        192.168.1.23          TLSv1.3  1506   Server Hello, Change Cipher Spec, Application Data

Frame 61: 1506 bytes on wire (12048 bits), 1506 bytes captured (12048 bits)
Ethernet II, Src: SagemcomBroa_35:92:33 (38:35:fb:35:92:33), Dst: AzureWaveTec_50:78:a5 (b4:8c:9d:50:78:a5)
Internet Protocol Version 4, Src: 46.105.132.157 (46.105.132.157), Dst: 192.168.1.23 (192.168.1.23)
Transmission Control Protocol, Src Port: https (443), Dst Port: 43340 (43340), Seq: 1, Ack: 1792, Len: 1440
Transport Layer Security

No.     Time           Source                Destination           Protocol Length Info
     62 2.269872       192.168.1.23          46.105.132.157        TCP      66     43340 → https(443) [ACK] Seq=1792 Ack=1441 Win=64128 Len=0 TSval=1359368725 TSecr=2600847896

Frame 62: 66 bytes on wire (528 bits), 66 bytes captured (528 bits)
Ethernet II, Src: AzureWaveTec_50:78:a5 (b4:8c:9d:50:78:a5), Dst: SagemcomBroa_35:92:33 (38:35:fb:35:92:33)
Internet Protocol Version 4, Src: 192.168.1.23 (192.168.1.23), Dst: 46.105.132.157 (46.105.132.157)
Transmission Control Protocol, Src Port: 43340 (43340), Dst Port: https (443), Seq: 1792, Ack: 1441, Len: 0

No.     Time           Source                Destination           Protocol Length Info
     63 2.269970       46.105.132.157        192.168.1.23          TCP      1506   https(443) → 43340 [PSH, ACK] Seq=1441 Ack=1792 Win=64128 Len=1440 TSval=2600847896 TSecr=1359368705 [TCP segment of a reassembled PDU]

Frame 63: 1506 bytes on wire (12048 bits), 1506 bytes captured (12048 bits)
Ethernet II, Src: SagemcomBroa_35:92:33 (38:35:fb:35:92:33), Dst: AzureWaveTec_50:78:a5 (b4:8c:9d:50:78:a5)
Internet Protocol Version 4, Src: 46.105.132.157 (46.105.132.157), Dst: 192.168.1.23 (192.168.1.23)
Transmission Control Protocol, Src Port: https (443), Dst Port: 43340 (43340), Seq: 1441, Ack: 1792, Len: 1440

No.     Time           Source                Destination           Protocol Length Info
     64 2.269973       192.168.1.23          46.105.132.157        TCP      66     43340 → https(443) [ACK] Seq=1792 Ack=2881 Win=64128 Len=0 TSval=1359368725 TSecr=2600847896

Frame 64: 66 bytes on wire (528 bits), 66 bytes captured (528 bits)
Ethernet II, Src: AzureWaveTec_50:78:a5 (b4:8c:9d:50:78:a5), Dst: SagemcomBroa_35:92:33 (38:35:fb:35:92:33)
Internet Protocol Version 4, Src: 192.168.1.23 (192.168.1.23), Dst: 46.105.132.157 (46.105.132.157)
Transmission Control Protocol, Src Port: 43340 (43340), Dst Port: https (443), Seq: 1792, Ack: 2881, Len: 0

No.     Time           Source                Destination           Protocol Length Info
     65 2.270056       46.105.132.157        192.168.1.23          TCP      1282   https(443) → 43340 [PSH, ACK] Seq=2881 Ack=1792 Win=64128 Len=1216 TSval=2600847896 TSecr=1359368705 [TCP segment of a reassembled PDU]

Frame 65: 1282 bytes on wire (10256 bits), 1282 bytes captured (10256 bits)
Ethernet II, Src: SagemcomBroa_35:92:33 (38:35:fb:35:92:33), Dst: AzureWaveTec_50:78:a5 (b4:8c:9d:50:78:a5)
Internet Protocol Version 4, Src: 46.105.132.157 (46.105.132.157), Dst: 192.168.1.23 (192.168.1.23)
Transmission Control Protocol, Src Port: https (443), Dst Port: 43340 (43340), Seq: 2881, Ack: 1792, Len: 1216

No.     Time           Source                Destination           Protocol Length Info
     66 2.270058       192.168.1.23          46.105.132.157        TCP      66     43340 → https(443) [ACK] Seq=1792 Ack=4097 Win=64128 Len=0 TSval=1359368725 TSecr=2600847896

Frame 66: 66 bytes on wire (528 bits), 66 bytes captured (528 bits)
Ethernet II, Src: AzureWaveTec_50:78:a5 (b4:8c:9d:50:78:a5), Dst: SagemcomBroa_35:92:33 (38:35:fb:35:92:33)
Internet Protocol Version 4, Src: 192.168.1.23 (192.168.1.23), Dst: 46.105.132.157 (46.105.132.157)
Transmission Control Protocol, Src Port: 43340 (43340), Dst Port: https (443), Seq: 1792, Ack: 4097, Len: 0

No.     Time           Source                Destination           Protocol Length Info
     67 2.270157       46.105.132.157        192.168.1.23          TCP      1506   https(443) → 43340 [ACK] Seq=4097 Ack=1792 Win=64128 Len=1440 TSval=2600847897 TSecr=1359368705 [TCP segment of a reassembled PDU]

Frame 67: 1506 bytes on wire (12048 bits), 1506 bytes captured (12048 bits)
Ethernet II, Src: SagemcomBroa_35:92:33 (38:35:fb:35:92:33), Dst: AzureWaveTec_50:78:a5 (b4:8c:9d:50:78:a5)
Internet Protocol Version 4, Src: 46.105.132.157 (46.105.132.157), Dst: 192.168.1.23 (192.168.1.23)
Transmission Control Protocol, Src Port: https (443), Dst Port: 43340 (43340), Seq: 4097, Ack: 1792, Len: 1440

No.     Time           Source                Destination           Protocol Length Info
     68 2.270159       192.168.1.23          46.105.132.157        TCP      66     43340 → https(443) [ACK] Seq=1792 Ack=5537 Win=64128 Len=0 TSval=1359368725 TSecr=2600847897

Frame 68: 66 bytes on wire (528 bits), 66 bytes captured (528 bits)
Ethernet II, Src: AzureWaveTec_50:78:a5 (b4:8c:9d:50:78:a5), Dst: SagemcomBroa_35:92:33 (38:35:fb:35:92:33)
Internet Protocol Version 4, Src: 192.168.1.23 (192.168.1.23), Dst: 46.105.132.157 (46.105.132.157)
Transmission Control Protocol, Src Port: 43340 (43340), Dst Port: https (443), Seq: 1792, Ack: 5537, Len: 0

No.     Time           Source                Destination           Protocol Length Info
     69 2.270226       46.105.132.157        192.168.1.23          TLSv1.3  1041   Application Data, Application Data, Application Data

Frame 69: 1041 bytes on wire (8328 bits), 1041 bytes captured (8328 bits)
Ethernet II, Src: SagemcomBroa_35:92:33 (38:35:fb:35:92:33), Dst: AzureWaveTec_50:78:a5 (b4:8c:9d:50:78:a5)
Internet Protocol Version 4, Src: 46.105.132.157 (46.105.132.157), Dst: 192.168.1.23 (192.168.1.23)
Transmission Control Protocol, Src Port: https (443), Dst Port: 43340 (43340), Seq: 5537, Ack: 1792, Len: 975
[5 Reassembled TCP Segments (5993 bytes): #61(1266), #63(1440), #65(1216), #67(1440), #69(631)]
Transport Layer Security
Transport Layer Security

No.     Time           Source                Destination           Protocol Length Info
     70 2.270228       192.168.1.23          46.105.132.157        TCP      66     43340 → https(443) [ACK] Seq=1792 Ack=6512 Win=64128 Len=0 TSval=1359368725 TSecr=2600847897

Frame 70: 66 bytes on wire (528 bits), 66 bytes captured (528 bits)
Ethernet II, Src: AzureWaveTec_50:78:a5 (b4:8c:9d:50:78:a5), Dst: SagemcomBroa_35:92:33 (38:35:fb:35:92:33)
Internet Protocol Version 4, Src: 192.168.1.23 (192.168.1.23), Dst: 46.105.132.157 (46.105.132.157)
Transmission Control Protocol, Src Port: 43340 (43340), Dst Port: https (443), Seq: 1792, Ack: 6512, Len: 0

No.     Time           Source                Destination           Protocol Length Info
     71 2.272002       192.168.1.23          46.105.132.157        TLSv1.3  130    Change Cipher Spec, Application Data

Frame 71: 130 bytes on wire (1040 bits), 130 bytes captured (1040 bits)
Ethernet II, Src: AzureWaveTec_50:78:a5 (b4:8c:9d:50:78:a5), Dst: SagemcomBroa_35:92:33 (38:35:fb:35:92:33)
Internet Protocol Version 4, Src: 192.168.1.23 (192.168.1.23), Dst: 46.105.132.157 (46.105.132.157)
Transmission Control Protocol, Src Port: 43340 (43340), Dst Port: https (443), Seq: 1792, Ack: 6512, Len: 64
Transport Layer Security

No.     Time           Source                Destination           Protocol Length Info
     72 2.272096       192.168.1.23          46.105.132.157        TLSv1.3  158    Application Data

Frame 72: 158 bytes on wire (1264 bits), 158 bytes captured (1264 bits)
Ethernet II, Src: AzureWaveTec_50:78:a5 (b4:8c:9d:50:78:a5), Dst: SagemcomBroa_35:92:33 (38:35:fb:35:92:33)
Internet Protocol Version 4, Src: 192.168.1.23 (192.168.1.23), Dst: 46.105.132.157 (46.105.132.157)
Transmission Control Protocol, Src Port: 43340 (43340), Dst Port: https (443), Seq: 1856, Ack: 6512, Len: 92
Transport Layer Security

No.     Time           Source                Destination           Protocol Length Info
     73 2.272185       192.168.1.23          46.105.132.157        TCP      1506   43340 → https(443) [ACK] Seq=1948 Ack=6512 Win=64128 Len=1440 TSval=1359368727 TSecr=2600847897 [TCP segment of a reassembled PDU]

Frame 73: 1506 bytes on wire (12048 bits), 1506 bytes captured (12048 bits)
Ethernet II, Src: AzureWaveTec_50:78:a5 (b4:8c:9d:50:78:a5), Dst: SagemcomBroa_35:92:33 (38:35:fb:35:92:33)
Internet Protocol Version 4, Src: 192.168.1.23 (192.168.1.23), Dst: 46.105.132.157 (46.105.132.157)
Transmission Control Protocol, Src Port: 43340 (43340), Dst Port: https (443), Seq: 1948, Ack: 6512, Len: 1440

No.     Time           Source                Destination           Protocol Length Info
     74 2.272187       192.168.1.23          46.105.132.157        TLSv1.3  558    Application Data

Frame 74: 558 bytes on wire (4464 bits), 558 bytes captured (4464 bits)
Ethernet II, Src: AzureWaveTec_50:78:a5 (b4:8c:9d:50:78:a5), Dst: SagemcomBroa_35:92:33 (38:35:fb:35:92:33)
Internet Protocol Version 4, Src: 192.168.1.23 (192.168.1.23), Dst: 46.105.132.157 (46.105.132.157)
Transmission Control Protocol, Src Port: 43340 (43340), Dst Port: https (443), Seq: 3388, Ack: 6512, Len: 492
[2 Reassembled TCP Segments (1932 bytes): #73(1440), #74(492)]
Transport Layer Security

No.     Time           Source                Destination           Protocol Length Info
     83 2.289176       46.105.132.157        192.168.1.23          TLSv1.3  145    Application Data

Frame 83: 145 bytes on wire (1160 bits), 145 bytes captured (1160 bits)
Ethernet II, Src: SagemcomBroa_35:92:33 (38:35:fb:35:92:33), Dst: AzureWaveTec_50:78:a5 (b4:8c:9d:50:78:a5)
Internet Protocol Version 4, Src: 46.105.132.157 (46.105.132.157), Dst: 192.168.1.23 (192.168.1.23)
Transmission Control Protocol, Src Port: https (443), Dst Port: 43340 (43340), Seq: 6512, Ack: 1948, Len: 79
Transport Layer Security

No.     Time           Source                Destination           Protocol Length Info
     84 2.289197       46.105.132.157        192.168.1.23          TLSv1.3  145    Application Data

Frame 84: 145 bytes on wire (1160 bits), 145 bytes captured (1160 bits)
Ethernet II, Src: SagemcomBroa_35:92:33 (38:35:fb:35:92:33), Dst: AzureWaveTec_50:78:a5 (b4:8c:9d:50:78:a5)
Internet Protocol Version 4, Src: 46.105.132.157 (46.105.132.157), Dst: 192.168.1.23 (192.168.1.23)
Transmission Control Protocol, Src Port: https (443), Dst Port: 43340 (43340), Seq: 6591, Ack: 1948, Len: 79
Transport Layer Security

No.     Time           Source                Destination           Protocol Length Info
     85 2.289198       46.105.132.157        192.168.1.23          TLSv1.3  130    Application Data

Frame 85: 130 bytes on wire (1040 bits), 130 bytes captured (1040 bits)
Ethernet II, Src: SagemcomBroa_35:92:33 (38:35:fb:35:92:33), Dst: AzureWaveTec_50:78:a5 (b4:8c:9d:50:78:a5)
Internet Protocol Version 4, Src: 46.105.132.157 (46.105.132.157), Dst: 192.168.1.23 (192.168.1.23)
Transmission Control Protocol, Src Port: https (443), Dst Port: 43340 (43340), Seq: 6670, Ack: 1948, Len: 64
Transport Layer Security

No.     Time           Source                Destination           Protocol Length Info
     86 2.289224       192.168.1.23          46.105.132.157        TCP      66     43340 → https(443) [ACK] Seq=3880 Ack=6734 Win=64128 Len=0 TSval=1359368744 TSecr=2600847917

Frame 86: 66 bytes on wire (528 bits), 66 bytes captured (528 bits)
Ethernet II, Src: AzureWaveTec_50:78:a5 (b4:8c:9d:50:78:a5), Dst: SagemcomBroa_35:92:33 (38:35:fb:35:92:33)
Internet Protocol Version 4, Src: 192.168.1.23 (192.168.1.23), Dst: 46.105.132.157 (46.105.132.157)
Transmission Control Protocol, Src Port: 43340 (43340), Dst Port: https (443), Seq: 3880, Ack: 6734, Len: 0

No.     Time           Source                Destination           Protocol Length Info
     87 2.289276       192.168.1.23          46.105.132.157        TLSv1.3  97     Application Data

Frame 87: 97 bytes on wire (776 bits), 97 bytes captured (776 bits)
Ethernet II, Src: AzureWaveTec_50:78:a5 (b4:8c:9d:50:78:a5), Dst: SagemcomBroa_35:92:33 (38:35:fb:35:92:33)
Internet Protocol Version 4, Src: 192.168.1.23 (192.168.1.23), Dst: 46.105.132.157 (46.105.132.157)
Transmission Control Protocol, Src Port: 43340 (43340), Dst Port: https (443), Seq: 3880, Ack: 6734, Len: 31
Transport Layer Security

No.     Time           Source                Destination           Protocol Length Info
     88 2.292011       46.105.132.157        192.168.1.23          TCP      66     https(443) → 43340 [ACK] Seq=6734 Ack=3880 Win=64128 Len=0 TSval=2600847920 TSecr=1359368727

Frame 88: 66 bytes on wire (528 bits), 66 bytes captured (528 bits)
Ethernet II, Src: SagemcomBroa_35:92:33 (38:35:fb:35:92:33), Dst: AzureWaveTec_50:78:a5 (b4:8c:9d:50:78:a5)
Internet Protocol Version 4, Src: 46.105.132.157 (46.105.132.157), Dst: 192.168.1.23 (192.168.1.23)
Transmission Control Protocol, Src Port: https (443), Dst Port: 43340 (43340), Seq: 6734, Ack: 3880, Len: 0

No.     Time           Source                Destination           Protocol Length Info
    114 2.320771       46.105.132.157        192.168.1.23          TLSv1.3  1258   Application Data

Frame 114: 1258 bytes on wire (10064 bits), 1258 bytes captured (10064 bits)
Ethernet II, Src: SagemcomBroa_35:92:33 (38:35:fb:35:92:33), Dst: AzureWaveTec_50:78:a5 (b4:8c:9d:50:78:a5)
Internet Protocol Version 4, Src: 46.105.132.157 (46.105.132.157), Dst: 192.168.1.23 (192.168.1.23)
Transmission Control Protocol, Src Port: https (443), Dst Port: 43340 (43340), Seq: 6734, Ack: 3911, Len: 1192
Transport Layer Security

No.     Time           Source                Destination           Protocol Length Info
    115 2.323266       192.168.1.23          46.105.132.157        TLSv1.3  301    Application Data

Frame 115: 301 bytes on wire (2408 bits), 301 bytes captured (2408 bits)
Ethernet II, Src: AzureWaveTec_50:78:a5 (b4:8c:9d:50:78:a5), Dst: SagemcomBroa_35:92:33 (38:35:fb:35:92:33)
Internet Protocol Version 4, Src: 192.168.1.23 (192.168.1.23), Dst: 46.105.132.157 (46.105.132.157)
Transmission Control Protocol, Src Port: 43340 (43340), Dst Port: https (443), Seq: 3911, Ack: 7926, Len: 235
Transport Layer Security

No.     Time           Source                Destination           Protocol Length Info
    121 2.380931       192.168.1.23          192.168.1.1           DNS      107    Standard query 0xd699 HTTPS google-ohttp-relay-safebrowsing.fastly-edge.com

Frame 121: 107 bytes on wire (856 bits), 107 bytes captured (856 bits)
Ethernet II, Src: AzureWaveTec_50:78:a5 (b4:8c:9d:50:78:a5), Dst: SagemcomBroa_35:92:33 (38:35:fb:35:92:33)
Internet Protocol Version 4, Src: 192.168.1.23 (192.168.1.23), Dst: 192.168.1.1 (192.168.1.1)
User Datagram Protocol, Src Port: 36867 (36867), Dst Port: domain (53)
Domain Name System (query)

No.     Time           Source                Destination           Protocol Length Info
    122 2.383466       46.105.132.157        192.168.1.23          TLSv1.3  1014   Application Data

Frame 122: 1014 bytes on wire (8112 bits), 1014 bytes captured (8112 bits)
Ethernet II, Src: SagemcomBroa_35:92:33 (38:35:fb:35:92:33), Dst: AzureWaveTec_50:78:a5 (b4:8c:9d:50:78:a5)
Internet Protocol Version 4, Src: 46.105.132.157 (46.105.132.157), Dst: 192.168.1.23 (192.168.1.23)
Transmission Control Protocol, Src Port: https (443), Dst Port: 43340 (43340), Seq: 7926, Ack: 4146, Len: 948
Transport Layer Security

No.     Time           Source                Destination           Protocol Length Info
    123 2.385867       192.168.1.23          46.105.132.157        TLSv1.3  154    Application Data

Frame 123: 154 bytes on wire (1232 bits), 154 bytes captured (1232 bits)
Ethernet II, Src: AzureWaveTec_50:78:a5 (b4:8c:9d:50:78:a5), Dst: SagemcomBroa_35:92:33 (38:35:fb:35:92:33)
Internet Protocol Version 4, Src: 192.168.1.23 (192.168.1.23), Dst: 46.105.132.157 (46.105.132.157)
Transmission Control Protocol, Src Port: 43340 (43340), Dst Port: https (443), Seq: 4146, Ack: 8874, Len: 88
Transport Layer Security

No.     Time           Source                Destination           Protocol Length Info
    126 2.398802       192.168.1.1           192.168.1.23          DNS      165    Standard query response 0xd699 HTTPS google-ohttp-relay-safebrowsing.fastly-edge.com SOA ns1.fastly-edge.com

Frame 126: 165 bytes on wire (1320 bits), 165 bytes captured (1320 bits)
Ethernet II, Src: SagemcomBroa_35:92:33 (38:35:fb:35:92:33), Dst: AzureWaveTec_50:78:a5 (b4:8c:9d:50:78:a5)
Internet Protocol Version 4, Src: 192.168.1.1 (192.168.1.1), Dst: 192.168.1.23 (192.168.1.23)
User Datagram Protocol, Src Port: domain (53), Dst Port: 36867 (36867)
Domain Name System (response)

No.     Time           Source                Destination           Protocol Length Info
    164 2.440425       46.105.132.157        192.168.1.23          TLSv1.3  1298   Application Data

Frame 164: 1298 bytes on wire (10384 bits), 1298 bytes captured (10384 bits)
Ethernet II, Src: SagemcomBroa_35:92:33 (38:35:fb:35:92:33), Dst: AzureWaveTec_50:78:a5 (b4:8c:9d:50:78:a5)
Internet Protocol Version 4, Src: 46.105.132.157 (46.105.132.157), Dst: 192.168.1.23 (192.168.1.23)
Transmission Control Protocol, Src Port: https (443), Dst Port: 43340 (43340), Seq: 8874, Ack: 4234, Len: 1232
Transport Layer Security

No.     Time           Source                Destination           Protocol Length Info
    189 2.484395       192.168.1.23          46.105.132.157        TCP      66     43340 → https(443) [ACK] Seq=4234 Ack=10106 Win=64128 Len=0 TSval=1359368940 TSecr=2600848066

Frame 189: 66 bytes on wire (528 bits), 66 bytes captured (528 bits)
Ethernet II, Src: AzureWaveTec_50:78:a5 (b4:8c:9d:50:78:a5), Dst: SagemcomBroa_35:92:33 (38:35:fb:35:92:33)
Internet Protocol Version 4, Src: 192.168.1.23 (192.168.1.23), Dst: 46.105.132.157 (46.105.132.157)
Transmission Control Protocol, Src Port: 43340 (43340), Dst Port: https (443), Seq: 4234, Ack: 10106, Len: 0

No.     Time           Source                Destination           Protocol Length Info
    296 3.226773       192.168.1.23          239.255.255.250       SSDP     214    M-SEARCH * HTTP/1.1 

Frame 296: 214 bytes on wire (1712 bits), 214 bytes captured (1712 bits)
Ethernet II, Src: AzureWaveTec_50:78:a5 (b4:8c:9d:50:78:a5), Dst: IPv4mcast_7f:ff:fa (01:00:5e:7f:ff:fa)
Internet Protocol Version 4, Src: 192.168.1.23 (192.168.1.23), Dst: 239.255.255.250 (239.255.255.250)
User Datagram Protocol, Src Port: 48059 (48059), Dst Port: ssdp (1900)
Simple Service Discovery Protocol

No.     Time           Source                Destination           Protocol Length Info
    297 3.227748       192.168.1.23          192.168.1.64          TCP      74     58378 → 56790 [SYN] Seq=0 Win=64240 Len=0 MSS=1460 SACK_PERM TSval=1763809752 TSecr=0 WS=128

Frame 297: 74 bytes on wire (592 bits), 74 bytes captured (592 bits)
Ethernet II, Src: AzureWaveTec_50:78:a5 (b4:8c:9d:50:78:a5), Dst: CiscoSPVTG_56:6b:62 (38:5f:66:56:6b:62)
Internet Protocol Version 4, Src: 192.168.1.23 (192.168.1.23), Dst: 192.168.1.64 (192.168.1.64)
Transmission Control Protocol, Src Port: 58378 (58378), Dst Port: 56790 (56790), Seq: 0, Len: 0

No.     Time           Source                Destination           Protocol Length Info
    298 3.228060       192.168.1.23          192.168.1.65          TCP      74     52742 → 56790 [SYN] Seq=0 Win=64240 Len=0 MSS=1460 SACK_PERM TSval=185160362 TSecr=0 WS=128

Frame 298: 74 bytes on wire (592 bits), 74 bytes captured (592 bits)
Ethernet II, Src: AzureWaveTec_50:78:a5 (b4:8c:9d:50:78:a5), Dst: CiscoSPVTG_53:08:83 (2c:ab:a4:53:08:83)
Internet Protocol Version 4, Src: 192.168.1.23 (192.168.1.23), Dst: 192.168.1.65 (192.168.1.65)
Transmission Control Protocol, Src Port: 52742 (52742), Dst Port: 56790 (56790), Seq: 0, Len: 0

No.     Time           Source                Destination           Protocol Length Info
    299 3.233537       192.168.1.65          192.168.1.23          TCP      74     56790 → 52742 [SYN, ACK] Seq=0 Ack=1 Win=14480 Len=0 MSS=1460 SACK_PERM TSval=1919961582 TSecr=185160362 WS=128

Frame 299: 74 bytes on wire (592 bits), 74 bytes captured (592 bits)
Ethernet II, Src: CiscoSPVTG_53:08:83 (2c:ab:a4:53:08:83), Dst: AzureWaveTec_50:78:a5 (b4:8c:9d:50:78:a5)
Internet Protocol Version 4, Src: 192.168.1.65 (192.168.1.65), Dst: 192.168.1.23 (192.168.1.23)
Transmission Control Protocol, Src Port: 56790 (56790), Dst Port: 52742 (52742), Seq: 0, Ack: 1, Len: 0

No.     Time           Source                Destination           Protocol Length Info
    300 3.233577       192.168.1.23          192.168.1.65          TCP      66     52742 → 56790 [ACK] Seq=1 Ack=1 Win=64256 Len=0 TSval=185160368 TSecr=1919961582

Frame 300: 66 bytes on wire (528 bits), 66 bytes captured (528 bits)
Ethernet II, Src: AzureWaveTec_50:78:a5 (b4:8c:9d:50:78:a5), Dst: CiscoSPVTG_53:08:83 (2c:ab:a4:53:08:83)
Internet Protocol Version 4, Src: 192.168.1.23 (192.168.1.23), Dst: 192.168.1.65 (192.168.1.65)
Transmission Control Protocol, Src Port: 52742 (52742), Dst Port: 56790 (56790), Seq: 1, Ack: 1, Len: 0

No.     Time           Source                Destination           Protocol Length Info
    301 3.233721       192.168.1.64          192.168.1.23          TCP      74     56790 → 58378 [SYN, ACK] Seq=0 Ack=1 Win=14480 Len=0 MSS=1460 SACK_PERM TSval=4139504975 TSecr=1763809752 WS=128

Frame 301: 74 bytes on wire (592 bits), 74 bytes captured (592 bits)
Ethernet II, Src: CiscoSPVTG_56:6b:62 (38:5f:66:56:6b:62), Dst: AzureWaveTec_50:78:a5 (b4:8c:9d:50:78:a5)
Internet Protocol Version 4, Src: 192.168.1.64 (192.168.1.64), Dst: 192.168.1.23 (192.168.1.23)
Transmission Control Protocol, Src Port: 56790 (56790), Dst Port: 58378 (58378), Seq: 0, Ack: 1, Len: 0

No.     Time           Source                Destination           Protocol Length Info
    302 3.233733       192.168.1.23          192.168.1.64          TCP      66     58378 → 56790 [ACK] Seq=1 Ack=1 Win=64256 Len=0 TSval=1763809758 TSecr=4139504975

Frame 302: 66 bytes on wire (528 bits), 66 bytes captured (528 bits)
Ethernet II, Src: AzureWaveTec_50:78:a5 (b4:8c:9d:50:78:a5), Dst: CiscoSPVTG_56:6b:62 (38:5f:66:56:6b:62)
Internet Protocol Version 4, Src: 192.168.1.23 (192.168.1.23), Dst: 192.168.1.64 (192.168.1.64)
Transmission Control Protocol, Src Port: 58378 (58378), Dst Port: 56790 (56790), Seq: 1, Ack: 1, Len: 0

No.     Time           Source                Destination           Protocol Length Info
    303 3.233737       192.168.1.64          192.168.1.23          SSDP     336    HTTP/1.1 200 OK 

Frame 303: 336 bytes on wire (2688 bits), 336 bytes captured (2688 bits)
Ethernet II, Src: CiscoSPVTG_56:6b:62 (38:5f:66:56:6b:62), Dst: AzureWaveTec_50:78:a5 (b4:8c:9d:50:78:a5)
Internet Protocol Version 4, Src: 192.168.1.64 (192.168.1.64), Dst: 192.168.1.23 (192.168.1.23)
User Datagram Protocol, Src Port: ssdp (1900), Dst Port: 48059 (48059)
Simple Service Discovery Protocol

No.     Time           Source                Destination           Protocol Length Info
    304 3.233756       192.168.1.65          192.168.1.23          SSDP     336    HTTP/1.1 200 OK 

Frame 304: 336 bytes on wire (2688 bits), 336 bytes captured (2688 bits)
Ethernet II, Src: CiscoSPVTG_53:08:83 (2c:ab:a4:53:08:83), Dst: AzureWaveTec_50:78:a5 (b4:8c:9d:50:78:a5)
Internet Protocol Version 4, Src: 192.168.1.65 (192.168.1.65), Dst: 192.168.1.23 (192.168.1.23)
User Datagram Protocol, Src Port: ssdp (1900), Dst Port: 48059 (48059)
Simple Service Discovery Protocol

No.     Time           Source                Destination           Protocol Length Info
    305 3.233817       192.168.1.23          192.168.1.65          HTTP     287    GET /dd.xml HTTP/1.1 

Frame 305: 287 bytes on wire (2296 bits), 287 bytes captured (2296 bits)
Ethernet II, Src: AzureWaveTec_50:78:a5 (b4:8c:9d:50:78:a5), Dst: CiscoSPVTG_53:08:83 (2c:ab:a4:53:08:83)
Internet Protocol Version 4, Src: 192.168.1.23 (192.168.1.23), Dst: 192.168.1.65 (192.168.1.65)
Transmission Control Protocol, Src Port: 52742 (52742), Dst Port: 56790 (56790), Seq: 1, Ack: 1, Len: 221
Hypertext Transfer Protocol

No.     Time           Source                Destination           Protocol Length Info
    306 3.233904       192.168.1.23          192.168.1.64          HTTP     287    GET /dd.xml HTTP/1.1 

Frame 306: 287 bytes on wire (2296 bits), 287 bytes captured (2296 bits)
Ethernet II, Src: AzureWaveTec_50:78:a5 (b4:8c:9d:50:78:a5), Dst: CiscoSPVTG_56:6b:62 (38:5f:66:56:6b:62)
Internet Protocol Version 4, Src: 192.168.1.23 (192.168.1.23), Dst: 192.168.1.64 (192.168.1.64)
Transmission Control Protocol, Src Port: 58378 (58378), Dst Port: 56790 (56790), Seq: 1, Ack: 1, Len: 221
Hypertext Transfer Protocol

No.     Time           Source                Destination           Protocol Length Info
    307 3.235902       192.168.1.64          192.168.1.23          TCP      66     56790 → 58378 [ACK] Seq=1 Ack=222 Win=15616 Len=0 TSval=4139504979 TSecr=1763809758

Frame 307: 66 bytes on wire (528 bits), 66 bytes captured (528 bits)
Ethernet II, Src: CiscoSPVTG_56:6b:62 (38:5f:66:56:6b:62), Dst: AzureWaveTec_50:78:a5 (b4:8c:9d:50:78:a5)
Internet Protocol Version 4, Src: 192.168.1.64 (192.168.1.64), Dst: 192.168.1.23 (192.168.1.23)
Transmission Control Protocol, Src Port: 56790 (56790), Dst Port: 58378 (58378), Seq: 1, Ack: 222, Len: 0

No.     Time           Source                Destination           Protocol Length Info
    308 3.236621       192.168.1.64          192.168.1.23          TCP      166    56790 → 58378 [PSH, ACK] Seq=1 Ack=222 Win=15616 Len=100 TSval=4139504979 TSecr=1763809758 [TCP segment of a reassembled PDU]

Frame 308: 166 bytes on wire (1328 bits), 166 bytes captured (1328 bits)
Ethernet II, Src: CiscoSPVTG_56:6b:62 (38:5f:66:56:6b:62), Dst: AzureWaveTec_50:78:a5 (b4:8c:9d:50:78:a5)
Internet Protocol Version 4, Src: 192.168.1.64 (192.168.1.64), Dst: 192.168.1.23 (192.168.1.23)
Transmission Control Protocol, Src Port: 56790 (56790), Dst Port: 58378 (58378), Seq: 1, Ack: 222, Len: 100

No.     Time           Source                Destination           Protocol Length Info
    309 3.236636       192.168.1.23          192.168.1.64          TCP      66     58378 → 56790 [ACK] Seq=222 Ack=101 Win=64256 Len=0 TSval=1763809761 TSecr=4139504979

Frame 309: 66 bytes on wire (528 bits), 66 bytes captured (528 bits)
Ethernet II, Src: AzureWaveTec_50:78:a5 (b4:8c:9d:50:78:a5), Dst: CiscoSPVTG_56:6b:62 (38:5f:66:56:6b:62)
Internet Protocol Version 4, Src: 192.168.1.23 (192.168.1.23), Dst: 192.168.1.64 (192.168.1.64)
Transmission Control Protocol, Src Port: 58378 (58378), Dst Port: 56790 (56790), Seq: 222, Ack: 101, Len: 0

No.     Time           Source                Destination           Protocol Length Info
    310 3.237350       192.168.1.64          192.168.1.23          HTTP/XML 535    HTTP/1.1 200 OK 

Frame 310: 535 bytes on wire (4280 bits), 535 bytes captured (4280 bits)
Ethernet II, Src: CiscoSPVTG_56:6b:62 (38:5f:66:56:6b:62), Dst: AzureWaveTec_50:78:a5 (b4:8c:9d:50:78:a5)
Internet Protocol Version 4, Src: 192.168.1.64 (192.168.1.64), Dst: 192.168.1.23 (192.168.1.23)
Transmission Control Protocol, Src Port: 56790 (56790), Dst Port: 58378 (58378), Seq: 101, Ack: 222, Len: 469
[2 Reassembled TCP Segments (569 bytes): #308(100), #310(469)]
Hypertext Transfer Protocol
eXtensible Markup Language

No.     Time           Source                Destination           Protocol Length Info
    311 3.237735       192.168.1.23          192.168.1.64          TCP      66     58378 → 56790 [FIN, ACK] Seq=222 Ack=571 Win=64128 Len=0 TSval=1763809762 TSecr=4139504979

Frame 311: 66 bytes on wire (528 bits), 66 bytes captured (528 bits)
Ethernet II, Src: AzureWaveTec_50:78:a5 (b4:8c:9d:50:78:a5), Dst: CiscoSPVTG_56:6b:62 (38:5f:66:56:6b:62)
Internet Protocol Version 4, Src: 192.168.1.23 (192.168.1.23), Dst: 192.168.1.64 (192.168.1.64)
Transmission Control Protocol, Src Port: 58378 (58378), Dst Port: 56790 (56790), Seq: 222, Ack: 571, Len: 0

No.     Time           Source                Destination           Protocol Length Info
    312 3.238695       192.168.1.65          192.168.1.23          TCP      66     56790 → 52742 [ACK] Seq=1 Ack=222 Win=15616 Len=0 TSval=1919961587 TSecr=185160368

Frame 312: 66 bytes on wire (528 bits), 66 bytes captured (528 bits)
Ethernet II, Src: CiscoSPVTG_53:08:83 (2c:ab:a4:53:08:83), Dst: AzureWaveTec_50:78:a5 (b4:8c:9d:50:78:a5)
Internet Protocol Version 4, Src: 192.168.1.65 (192.168.1.65), Dst: 192.168.1.23 (192.168.1.23)
Transmission Control Protocol, Src Port: 56790 (56790), Dst Port: 52742 (52742), Seq: 1, Ack: 222, Len: 0

No.     Time           Source                Destination           Protocol Length Info
