No.     Time           Source                Destination           Protocol Length Info
     68 2.105557       192.168.1.23          46.105.132.156        TCP      74     59718 → 443 [SYN] Seq=0 Win=64240 Len=0 MSS=1460 SACK_PERM TSval=393698687 TSecr=0 WS=128

Frame 68: 74 bytes on wire (592 bits), 74 bytes captured (592 bits)
Ethernet II, Src: AzureWaveTec_50:78:a5 (b4:8c:9d:50:78:a5), Dst: SagemcomBroa_35:92:33 (38:35:fb:35:92:33)
Internet Protocol Version 4, Src: 192.168.1.23, Dst: 46.105.132.156
Transmission Control Protocol, Src Port: 59718, Dst Port: 443, Seq: 0, Len: 0

No.     Time           Source                Destination           Protocol Length Info
     71 2.120150       46.105.132.156        192.168.1.23          TCP      74     443 → 59718 [SYN, ACK] Seq=0 Ack=1 Win=65160 Len=0 MSS=1452 SACK_PERM TSval=2253458015 TSecr=393698687 WS=128

Frame 71: 74 bytes on wire (592 bits), 74 bytes captured (592 bits)
Ethernet II, Src: SagemcomBroa_35:92:33 (38:35:fb:35:92:33), Dst: AzureWaveTec_50:78:a5 (b4:8c:9d:50:78:a5)
Internet Protocol Version 4, Src: 46.105.132.156, Dst: 192.168.1.23
Transmission Control Protocol, Src Port: 443, Dst Port: 59718, Seq: 0, Ack: 1, Len: 0

No.     Time           Source                Destination           Protocol Length Info
     72 2.120222       192.168.1.23          46.105.132.156        TCP      66     59718 → 443 [ACK] Seq=1 Ack=1 Win=64256 Len=0 TSval=393698702 TSecr=2253458015

Frame 72: 66 bytes on wire (528 bits), 66 bytes captured (528 bits)
Ethernet II, Src: AzureWaveTec_50:78:a5 (b4:8c:9d:50:78:a5), Dst: SagemcomBroa_35:92:33 (38:35:fb:35:92:33)
Internet Protocol Version 4, Src: 192.168.1.23, Dst: 46.105.132.156
Transmission Control Protocol, Src Port: 59718, Dst Port: 443, Seq: 1, Ack: 1, Len: 0

No.     Time           Source                Destination           Protocol Length Info
     73 2.121006       192.168.1.23          46.105.132.156        TCP      1506   59718 → 443 [ACK] Seq=1 Ack=1 Win=64256 Len=1440 TSval=393698702 TSecr=2253458015 [TCP segment of a reassembled PDU]

Frame 73: 1506 bytes on wire (12048 bits), 1506 bytes captured (12048 bits)
Ethernet II, Src: AzureWaveTec_50:78:a5 (b4:8c:9d:50:78:a5), Dst: SagemcomBroa_35:92:33 (38:35:fb:35:92:33)
Internet Protocol Version 4, Src: 192.168.1.23, Dst: 46.105.132.156
Transmission Control Protocol, Src Port: 59718, Dst Port: 443, Seq: 1, Ack: 1, Len: 1440

No.     Time           Source                Destination           Protocol Length Info
     74 2.121020       192.168.1.23          46.105.132.156        TLSv1.3  353    Client Hello (SNI=drive.shadow.tech)

Frame 74: 353 bytes on wire (2824 bits), 353 bytes captured (2824 bits)
Ethernet II, Src: AzureWaveTec_50:78:a5 (b4:8c:9d:50:78:a5), Dst: SagemcomBroa_35:92:33 (38:35:fb:35:92:33)
Internet Protocol Version 4, Src: 192.168.1.23, Dst: 46.105.132.156
Transmission Control Protocol, Src Port: 59718, Dst Port: 443, Seq: 1441, Ack: 1, Len: 287
[2 Reassembled TCP Segments (1727 bytes): #73(1440), #74(287)]
Transport Layer Security

No.     Time           Source                Destination           Protocol Length Info
     85 2.139583       46.105.132.156        192.168.1.23          TCP      66     443 → 59718 [ACK] Seq=1 Ack=1728 Win=64128 Len=0 TSval=2253458034 TSecr=393698702

Frame 85: 66 bytes on wire (528 bits), 66 bytes captured (528 bits)
Ethernet II, Src: SagemcomBroa_35:92:33 (38:35:fb:35:92:33), Dst: AzureWaveTec_50:78:a5 (b4:8c:9d:50:78:a5)
Internet Protocol Version 4, Src: 46.105.132.156, Dst: 192.168.1.23
Transmission Control Protocol, Src Port: 443, Dst Port: 59718, Seq: 1, Ack: 1728, Len: 0

No.     Time           Source                Destination           Protocol Length Info
     86 2.139914       46.105.132.156        192.168.1.23          TLSv1.3  1506   Server Hello, Change Cipher Spec, Application Data

Frame 86: 1506 bytes on wire (12048 bits), 1506 bytes captured (12048 bits)
Ethernet II, Src: SagemcomBroa_35:92:33 (38:35:fb:35:92:33), Dst: AzureWaveTec_50:78:a5 (b4:8c:9d:50:78:a5)
Internet Protocol Version 4, Src: 46.105.132.156, Dst: 192.168.1.23
Transmission Control Protocol, Src Port: 443, Dst Port: 59718, Seq: 1, Ack: 1728, Len: 1440
Transport Layer Security

No.     Time           Source                Destination           Protocol Length Info
     87 2.139939       192.168.1.23          46.105.132.156        TCP      66     59718 → 443 [ACK] Seq=1728 Ack=1441 Win=64128 Len=0 TSval=393698721 TSecr=2253458034

Frame 87: 66 bytes on wire (528 bits), 66 bytes captured (528 bits)
Ethernet II, Src: AzureWaveTec_50:78:a5 (b4:8c:9d:50:78:a5), Dst: SagemcomBroa_35:92:33 (38:35:fb:35:92:33)
Internet Protocol Version 4, Src: 192.168.1.23, Dst: 46.105.132.156
Transmission Control Protocol, Src Port: 59718, Dst Port: 443, Seq: 1728, Ack: 1441, Len: 0

No.     Time           Source                Destination           Protocol Length Info
     88 2.139990       46.105.132.156        192.168.1.23          TCP      1506   443 → 59718 [PSH, ACK] Seq=1441 Ack=1728 Win=64128 Len=1440 TSval=2253458034 TSecr=393698702 [TCP segment of a reassembled PDU]

Frame 88: 1506 bytes on wire (12048 bits), 1506 bytes captured (12048 bits)
Ethernet II, Src: SagemcomBroa_35:92:33 (38:35:fb:35:92:33), Dst: AzureWaveTec_50:78:a5 (b4:8c:9d:50:78:a5)
Internet Protocol Version 4, Src: 46.105.132.156, Dst: 192.168.1.23
Transmission Control Protocol, Src Port: 443, Dst Port: 59718, Seq: 1441, Ack: 1728, Len: 1440

No.     Time           Source                Destination           Protocol Length Info
     89 2.139994       192.168.1.23          46.105.132.156        TCP      66     59718 → 443 [ACK] Seq=1728 Ack=2881 Win=64128 Len=0 TSval=393698721 TSecr=2253458034

Frame 89: 66 bytes on wire (528 bits), 66 bytes captured (528 bits)
Ethernet II, Src: AzureWaveTec_50:78:a5 (b4:8c:9d:50:78:a5), Dst: SagemcomBroa_35:92:33 (38:35:fb:35:92:33)
Internet Protocol Version 4, Src: 192.168.1.23, Dst: 46.105.132.156
Transmission Control Protocol, Src Port: 59718, Dst Port: 443, Seq: 1728, Ack: 2881, Len: 0

No.     Time           Source                Destination           Protocol Length Info
     90 2.140066       46.105.132.156        192.168.1.23          TCP      1282   443 → 59718 [PSH, ACK] Seq=2881 Ack=1728 Win=64128 Len=1216 TSval=2253458034 TSecr=393698702 [TCP segment of a reassembled PDU]

Frame 90: 1282 bytes on wire (10256 bits), 1282 bytes captured (10256 bits)
Ethernet II, Src: SagemcomBroa_35:92:33 (38:35:fb:35:92:33), Dst: AzureWaveTec_50:78:a5 (b4:8c:9d:50:78:a5)
Internet Protocol Version 4, Src: 46.105.132.156, Dst: 192.168.1.23
Transmission Control Protocol, Src Port: 443, Dst Port: 59718, Seq: 2881, Ack: 1728, Len: 1216

No.     Time           Source                Destination           Protocol Length Info
     91 2.140074       192.168.1.23          46.105.132.156        TCP      66     59718 → 443 [ACK] Seq=1728 Ack=4097 Win=63232 Len=0 TSval=393698721 TSecr=2253458034

Frame 91: 66 bytes on wire (528 bits), 66 bytes captured (528 bits)
Ethernet II, Src: AzureWaveTec_50:78:a5 (b4:8c:9d:50:78:a5), Dst: SagemcomBroa_35:92:33 (38:35:fb:35:92:33)
Internet Protocol Version 4, Src: 192.168.1.23, Dst: 46.105.132.156
Transmission Control Protocol, Src Port: 59718, Dst Port: 443, Seq: 1728, Ack: 4097, Len: 0

No.     Time           Source                Destination           Protocol Length Info
     92 2.140141       46.105.132.156        192.168.1.23          TCP      1506   443 → 59718 [ACK] Seq=4097 Ack=1728 Win=64128 Len=1440 TSval=2253458035 TSecr=393698702 [TCP segment of a reassembled PDU]

Frame 92: 1506 bytes on wire (12048 bits), 1506 bytes captured (12048 bits)
Ethernet II, Src: SagemcomBroa_35:92:33 (38:35:fb:35:92:33), Dst: AzureWaveTec_50:78:a5 (b4:8c:9d:50:78:a5)
Internet Protocol Version 4, Src: 46.105.132.156, Dst: 192.168.1.23
Transmission Control Protocol, Src Port: 443, Dst Port: 59718, Seq: 4097, Ack: 1728, Len: 1440

No.     Time           Source                Destination           Protocol Length Info
     93 2.140146       192.168.1.23          46.105.132.156        TCP      66     59718 → 443 [ACK] Seq=1728 Ack=5537 Win=62080 Len=0 TSval=393698722 TSecr=2253458035

Frame 93: 66 bytes on wire (528 bits), 66 bytes captured (528 bits)
Ethernet II, Src: AzureWaveTec_50:78:a5 (b4:8c:9d:50:78:a5), Dst: SagemcomBroa_35:92:33 (38:35:fb:35:92:33)
Internet Protocol Version 4, Src: 192.168.1.23, Dst: 46.105.132.156
Transmission Control Protocol, Src Port: 59718, Dst Port: 443, Seq: 1728, Ack: 5537, Len: 0

No.     Time           Source                Destination           Protocol Length Info
     94 2.140698       46.105.132.156        192.168.1.23          TLSv1.3  1041   Application Data, Application Data, Application Data

Frame 94: 1041 bytes on wire (8328 bits), 1041 bytes captured (8328 bits)
Ethernet II, Src: SagemcomBroa_35:92:33 (38:35:fb:35:92:33), Dst: AzureWaveTec_50:78:a5 (b4:8c:9d:50:78:a5)
Internet Protocol Version 4, Src: 46.105.132.156, Dst: 192.168.1.23
Transmission Control Protocol, Src Port: 443, Dst Port: 59718, Seq: 5537, Ack: 1728, Len: 975
[5 Reassembled TCP Segments (5993 bytes): #86(1266), #88(1440), #90(1216), #92(1440), #94(631)]
Transport Layer Security
Transport Layer Security

No.     Time           Source                Destination           Protocol Length Info
     95 2.140711       192.168.1.23          46.105.132.156        TCP      66     59718 → 443 [ACK] Seq=1728 Ack=6512 Win=64128 Len=0 TSval=393698722 TSecr=2253458035

Frame 95: 66 bytes on wire (528 bits), 66 bytes captured (528 bits)
Ethernet II, Src: AzureWaveTec_50:78:a5 (b4:8c:9d:50:78:a5), Dst: SagemcomBroa_35:92:33 (38:35:fb:35:92:33)
Internet Protocol Version 4, Src: 192.168.1.23, Dst: 46.105.132.156
Transmission Control Protocol, Src Port: 59718, Dst Port: 443, Seq: 1728, Ack: 6512, Len: 0

No.     Time           Source                Destination           Protocol Length Info
     96 2.145381       192.168.1.23          46.105.132.156        TLSv1.3  130    Change Cipher Spec, Application Data

Frame 96: 130 bytes on wire (1040 bits), 130 bytes captured (1040 bits)
Ethernet II, Src: AzureWaveTec_50:78:a5 (b4:8c:9d:50:78:a5), Dst: SagemcomBroa_35:92:33 (38:35:fb:35:92:33)
Internet Protocol Version 4, Src: 192.168.1.23, Dst: 46.105.132.156
Transmission Control Protocol, Src Port: 59718, Dst Port: 443, Seq: 1728, Ack: 6512, Len: 64
Transport Layer Security

No.     Time           Source                Destination           Protocol Length Info
     97 2.145682       192.168.1.23          46.105.132.156        TLSv1.3  158    Application Data

Frame 97: 158 bytes on wire (1264 bits), 158 bytes captured (1264 bits)
Ethernet II, Src: AzureWaveTec_50:78:a5 (b4:8c:9d:50:78:a5), Dst: SagemcomBroa_35:92:33 (38:35:fb:35:92:33)
Internet Protocol Version 4, Src: 192.168.1.23, Dst: 46.105.132.156
Transmission Control Protocol, Src Port: 59718, Dst Port: 443, Seq: 1792, Ack: 6512, Len: 92
Transport Layer Security

No.     Time           Source                Destination           Protocol Length Info
     98 2.145965       192.168.1.23          46.105.132.156        TCP      1506   59718 → 443 [ACK] Seq=1884 Ack=6512 Win=64128 Len=1440 TSval=393698727 TSecr=2253458035 [TCP segment of a reassembled PDU]

Frame 98: 1506 bytes on wire (12048 bits), 1506 bytes captured (12048 bits)
Ethernet II, Src: AzureWaveTec_50:78:a5 (b4:8c:9d:50:78:a5), Dst: SagemcomBroa_35:92:33 (38:35:fb:35:92:33)
Internet Protocol Version 4, Src: 192.168.1.23, Dst: 46.105.132.156
Transmission Control Protocol, Src Port: 59718, Dst Port: 443, Seq: 1884, Ack: 6512, Len: 1440

No.     Time           Source                Destination           Protocol Length Info
     99 2.145969       192.168.1.23          46.105.132.156        TLSv1.3  330    Application Data

Frame 99: 330 bytes on wire (2640 bits), 330 bytes captured (2640 bits)
Ethernet II, Src: AzureWaveTec_50:78:a5 (b4:8c:9d:50:78:a5), Dst: SagemcomBroa_35:92:33 (38:35:fb:35:92:33)
Internet Protocol Version 4, Src: 192.168.1.23, Dst: 46.105.132.156
Transmission Control Protocol, Src Port: 59718, Dst Port: 443, Seq: 3324, Ack: 6512, Len: 264
[2 Reassembled TCP Segments (1704 bytes): #98(1440), #99(264)]
Transport Layer Security

No.     Time           Source                Destination           Protocol Length Info
    118 2.161645       46.105.132.156        192.168.1.23          TLSv1.3  145    Application Data

Frame 118: 145 bytes on wire (1160 bits), 145 bytes captured (1160 bits)
Ethernet II, Src: SagemcomBroa_35:92:33 (38:35:fb:35:92:33), Dst: AzureWaveTec_50:78:a5 (b4:8c:9d:50:78:a5)
Internet Protocol Version 4, Src: 46.105.132.156, Dst: 192.168.1.23
Transmission Control Protocol, Src Port: 443, Dst Port: 59718, Seq: 6512, Ack: 1792, Len: 79
Transport Layer Security

No.     Time           Source                Destination           Protocol Length Info
    119 2.161880       46.105.132.156        192.168.1.23          TLSv1.3  145    Application Data

Frame 119: 145 bytes on wire (1160 bits), 145 bytes captured (1160 bits)
Ethernet II, Src: SagemcomBroa_35:92:33 (38:35:fb:35:92:33), Dst: AzureWaveTec_50:78:a5 (b4:8c:9d:50:78:a5)
Internet Protocol Version 4, Src: 46.105.132.156, Dst: 192.168.1.23
Transmission Control Protocol, Src Port: 443, Dst Port: 59718, Seq: 6591, Ack: 1792, Len: 79
Transport Layer Security

No.     Time           Source                Destination           Protocol Length Info
    120 2.161952       192.168.1.23          46.105.132.156        TCP      66     59718 → 443 [ACK] Seq=3588 Ack=6670 Win=64128 Len=0 TSval=393698743 TSecr=2253458057

Frame 120: 66 bytes on wire (528 bits), 66 bytes captured (528 bits)
Ethernet II, Src: AzureWaveTec_50:78:a5 (b4:8c:9d:50:78:a5), Dst: SagemcomBroa_35:92:33 (38:35:fb:35:92:33)
Internet Protocol Version 4, Src: 192.168.1.23, Dst: 46.105.132.156
Transmission Control Protocol, Src Port: 59718, Dst Port: 443, Seq: 3588, Ack: 6670, Len: 0

No.     Time           Source                Destination           Protocol Length Info
    121 2.162049       46.105.132.156        192.168.1.23          TLSv1.3  130    Application Data

Frame 121: 130 bytes on wire (1040 bits), 130 bytes captured (1040 bits)
Ethernet II, Src: SagemcomBroa_35:92:33 (38:35:fb:35:92:33), Dst: AzureWaveTec_50:78:a5 (b4:8c:9d:50:78:a5)
Internet Protocol Version 4, Src: 46.105.132.156, Dst: 192.168.1.23
Transmission Control Protocol, Src Port: 443, Dst Port: 59718, Seq: 6670, Ack: 1884, Len: 64
Transport Layer Security

No.     Time           Source                Destination           Protocol Length Info
    122 2.162129       192.168.1.23          46.105.132.156        TLSv1.3  97     Application Data

Frame 122: 97 bytes on wire (776 bits), 97 bytes captured (776 bits)
Ethernet II, Src: AzureWaveTec_50:78:a5 (b4:8c:9d:50:78:a5), Dst: SagemcomBroa_35:92:33 (38:35:fb:35:92:33)
Internet Protocol Version 4, Src: 192.168.1.23, Dst: 46.105.132.156
Transmission Control Protocol, Src Port: 59718, Dst Port: 443, Seq: 3588, Ack: 6734, Len: 31
Transport Layer Security

No.     Time           Source                Destination           Protocol Length Info
    123 2.164310       46.105.132.156        192.168.1.23          TCP      66     443 → 59718 [ACK] Seq=6734 Ack=3588 Win=64128 Len=0 TSval=2253458060 TSecr=393698727

Frame 123: 66 bytes on wire (528 bits), 66 bytes captured (528 bits)
Ethernet II, Src: SagemcomBroa_35:92:33 (38:35:fb:35:92:33), Dst: AzureWaveTec_50:78:a5 (b4:8c:9d:50:78:a5)
Internet Protocol Version 4, Src: 46.105.132.156, Dst: 192.168.1.23
Transmission Control Protocol, Src Port: 443, Dst Port: 59718, Seq: 6734, Ack: 3588, Len: 0

No.     Time           Source                Destination           Protocol Length Info
    127 2.202482       46.105.132.156        192.168.1.23          TLSv1.3  1246   Application Data

Frame 127: 1246 bytes on wire (9968 bits), 1246 bytes captured (9968 bits)
Ethernet II, Src: SagemcomBroa_35:92:33 (38:35:fb:35:92:33), Dst: AzureWaveTec_50:78:a5 (b4:8c:9d:50:78:a5)
Internet Protocol Version 4, Src: 46.105.132.156, Dst: 192.168.1.23
Transmission Control Protocol, Src Port: 443, Dst Port: 59718, Seq: 6734, Ack: 3619, Len: 1180
Transport Layer Security

No.     Time           Source                Destination           Protocol Length Info
    134 2.214536       192.168.1.23          46.105.132.156        TLSv1.3  289    Application Data

Frame 134: 289 bytes on wire (2312 bits), 289 bytes captured (2312 bits)
Ethernet II, Src: AzureWaveTec_50:78:a5 (b4:8c:9d:50:78:a5), Dst: SagemcomBroa_35:92:33 (38:35:fb:35:92:33)
Internet Protocol Version 4, Src: 192.168.1.23, Dst: 46.105.132.156
Transmission Control Protocol, Src Port: 59718, Dst Port: 443, Seq: 3619, Ack: 7914, Len: 223
Transport Layer Security

No.     Time           Source                Destination           Protocol Length Info
    136 2.267207       46.105.132.156        192.168.1.23          TLSv1.3  1014   Application Data

Frame 136: 1014 bytes on wire (8112 bits), 1014 bytes captured (8112 bits)
Ethernet II, Src: SagemcomBroa_35:92:33 (38:35:fb:35:92:33), Dst: AzureWaveTec_50:78:a5 (b4:8c:9d:50:78:a5)
Internet Protocol Version 4, Src: 46.105.132.156, Dst: 192.168.1.23
Transmission Control Protocol, Src Port: 443, Dst Port: 59718, Seq: 7914, Ack: 3842, Len: 948
Transport Layer Security

No.     Time           Source                Destination           Protocol Length Info
    137 2.272949       192.168.1.23          46.105.132.156        TLSv1.3  151    Application Data

Frame 137: 151 bytes on wire (1208 bits), 151 bytes captured (1208 bits)
Ethernet II, Src: AzureWaveTec_50:78:a5 (b4:8c:9d:50:78:a5), Dst: SagemcomBroa_35:92:33 (38:35:fb:35:92:33)
Internet Protocol Version 4, Src: 192.168.1.23, Dst: 46.105.132.156
Transmission Control Protocol, Src Port: 59718, Dst Port: 443, Seq: 3842, Ack: 8862, Len: 85
Transport Layer Security

No.     Time           Source                Destination           Protocol Length Info
    138 2.323630       46.105.132.156        192.168.1.23          TLSv1.3  1298   Application Data

Frame 138: 1298 bytes on wire (10384 bits), 1298 bytes captured (10384 bits)
Ethernet II, Src: SagemcomBroa_35:92:33 (38:35:fb:35:92:33), Dst: AzureWaveTec_50:78:a5 (b4:8c:9d:50:78:a5)
Internet Protocol Version 4, Src: 46.105.132.156, Dst: 192.168.1.23
Transmission Control Protocol, Src Port: 443, Dst Port: 59718, Seq: 8862, Ack: 3927, Len: 1232
Transport Layer Security

No.     Time           Source                Destination           Protocol Length Info
    144 2.364119       192.168.1.23          46.105.132.156        TCP      66     59718 → 443 [ACK] Seq=3927 Ack=10094 Win=64128 Len=0 TSval=393698946 TSecr=2253458219

Frame 144: 66 bytes on wire (528 bits), 66 bytes captured (528 bits)
Ethernet II, Src: AzureWaveTec_50:78:a5 (b4:8c:9d:50:78:a5), Dst: SagemcomBroa_35:92:33 (38:35:fb:35:92:33)
Internet Protocol Version 4, Src: 192.168.1.23, Dst: 46.105.132.156
Transmission Control Protocol, Src Port: 59718, Dst Port: 443, Seq: 3927, Ack: 10094, Len: 0

No.     Time           Source                Destination           Protocol Length Info
    337 4.138854       192.168.1.23          46.105.132.156        TLSv1.3  284    Application Data

Frame 337: 284 bytes on wire (2272 bits), 284 bytes captured (2272 bits)
Ethernet II, Src: AzureWaveTec_50:78:a5 (b4:8c:9d:50:78:a5), Dst: SagemcomBroa_35:92:33 (38:35:fb:35:92:33)
Internet Protocol Version 4, Src: 192.168.1.23, Dst: 46.105.132.156
Transmission Control Protocol, Src Port: 59718, Dst Port: 443, Seq: 3927, Ack: 10094, Len: 218
Transport Layer Security

No.     Time           Source                Destination           Protocol Length Info
    343 4.197251       46.105.132.156        192.168.1.23          TCP      66     443 → 59718 [ACK] Seq=10094 Ack=4145 Win=64128 Len=0 TSval=2253460093 TSecr=393700720

Frame 343: 66 bytes on wire (528 bits), 66 bytes captured (528 bits)
Ethernet II, Src: SagemcomBroa_35:92:33 (38:35:fb:35:92:33), Dst: AzureWaveTec_50:78:a5 (b4:8c:9d:50:78:a5)
Internet Protocol Version 4, Src: 46.105.132.156, Dst: 192.168.1.23
Transmission Control Protocol, Src Port: 443, Dst Port: 59718, Seq: 10094, Ack: 4145, Len: 0

No.     Time           Source                Destination           Protocol Length Info
    344 4.672234       46.105.132.156        192.168.1.23          TLSv1.3  947    Application Data

Frame 344: 947 bytes on wire (7576 bits), 947 bytes captured (7576 bits)
Ethernet II, Src: SagemcomBroa_35:92:33 (38:35:fb:35:92:33), Dst: AzureWaveTec_50:78:a5 (b4:8c:9d:50:78:a5)
Internet Protocol Version 4, Src: 46.105.132.156, Dst: 192.168.1.23
Transmission Control Protocol, Src Port: 443, Dst Port: 59718, Seq: 10094, Ack: 4145, Len: 881
Transport Layer Security

No.     Time           Source                Destination           Protocol Length Info
    345 4.672273       192.168.1.23          46.105.132.156        TCP      66     59718 → 443 [ACK] Seq=4145 Ack=10975 Win=64128 Len=0 TSval=393701254 TSecr=2253460565

Frame 345: 66 bytes on wire (528 bits), 66 bytes captured (528 bits)
Ethernet II, Src: AzureWaveTec_50:78:a5 (b4:8c:9d:50:78:a5), Dst: SagemcomBroa_35:92:33 (38:35:fb:35:92:33)
Internet Protocol Version 4, Src: 192.168.1.23, Dst: 46.105.132.156
Transmission Control Protocol, Src Port: 59718, Dst Port: 443, Seq: 4145, Ack: 10975, Len: 0

No.     Time           Source                Destination           Protocol Length Info
    346 4.678381       192.168.1.23          46.105.132.156        TLSv1.3  164    Application Data

Frame 346: 164 bytes on wire (1312 bits), 164 bytes captured (1312 bits)
Ethernet II, Src: AzureWaveTec_50:78:a5 (b4:8c:9d:50:78:a5), Dst: SagemcomBroa_35:92:33 (38:35:fb:35:92:33)
Internet Protocol Version 4, Src: 192.168.1.23, Dst: 46.105.132.156
Transmission Control Protocol, Src Port: 59718, Dst Port: 443, Seq: 4145, Ack: 10975, Len: 98
Transport Layer Security

No.     Time           Source                Destination           Protocol Length Info
    347 4.692274       46.105.132.156        192.168.1.23          TCP      66     443 → 59718 [ACK] Seq=10975 Ack=4243 Win=64128 Len=0 TSval=2253460588 TSecr=393701260

Frame 347: 66 bytes on wire (528 bits), 66 bytes captured (528 bits)
Ethernet II, Src: SagemcomBroa_35:92:33 (38:35:fb:35:92:33), Dst: AzureWaveTec_50:78:a5 (b4:8c:9d:50:78:a5)
Internet Protocol Version 4, Src: 46.105.132.156, Dst: 192.168.1.23
Transmission Control Protocol, Src Port: 443, Dst Port: 59718, Seq: 10975, Ack: 4243, Len: 0

No.     Time           Source                Destination           Protocol Length Info
    348 4.743446       46.105.132.156        192.168.1.23          TLSv1.3  922    Application Data

Frame 348: 922 bytes on wire (7376 bits), 922 bytes captured (7376 bits)
Ethernet II, Src: SagemcomBroa_35:92:33 (38:35:fb:35:92:33), Dst: AzureWaveTec_50:78:a5 (b4:8c:9d:50:78:a5)
Internet Protocol Version 4, Src: 46.105.132.156, Dst: 192.168.1.23
Transmission Control Protocol, Src Port: 443, Dst Port: 59718, Seq: 10975, Ack: 4243, Len: 856
Transport Layer Security

No.     Time           Source                Destination           Protocol Length Info
    349 4.750263       192.168.1.23          46.105.132.156        TLSv1.3  145    Application Data

Frame 349: 145 bytes on wire (1160 bits), 145 bytes captured (1160 bits)
Ethernet II, Src: AzureWaveTec_50:78:a5 (b4:8c:9d:50:78:a5), Dst: SagemcomBroa_35:92:33 (38:35:fb:35:92:33)
Internet Protocol Version 4, Src: 192.168.1.23, Dst: 46.105.132.156
Transmission Control Protocol, Src Port: 59718, Dst Port: 443, Seq: 4243, Ack: 11831, Len: 79
Transport Layer Security

No.     Time           Source                Destination           Protocol Length Info
    351 4.766058       46.105.132.156        192.168.1.23          TCP      66     443 → 59718 [ACK] Seq=11831 Ack=4322 Win=64128 Len=0 TSval=2253460659 TSecr=393701332

Frame 351: 66 bytes on wire (528 bits), 66 bytes captured (528 bits)
Ethernet II, Src: SagemcomBroa_35:92:33 (38:35:fb:35:92:33), Dst: AzureWaveTec_50:78:a5 (b4:8c:9d:50:78:a5)
Internet Protocol Version 4, Src: 46.105.132.156, Dst: 192.168.1.23
Transmission Control Protocol, Src Port: 443, Dst Port: 59718, Seq: 11831, Ack: 4322, Len: 0

No.     Time           Source                Destination           Protocol Length Info
    355 4.898019       46.105.132.156        192.168.1.23          TCP      2946   443 → 59718 [PSH, ACK] Seq=11831 Ack=4322 Win=64128 Len=2880 TSval=2253460790 TSecr=393701332 [TCP segment of a reassembled PDU]

Frame 355: 2946 bytes on wire (23568 bits), 2946 bytes captured (23568 bits)
Ethernet II, Src: SagemcomBroa_35:92:33 (38:35:fb:35:92:33), Dst: AzureWaveTec_50:78:a5 (b4:8c:9d:50:78:a5)
Internet Protocol Version 4, Src: 46.105.132.156, Dst: 192.168.1.23
Transmission Control Protocol, Src Port: 443, Dst Port: 59718, Seq: 11831, Ack: 4322, Len: 2880

No.     Time           Source                Destination           Protocol Length Info
    356 4.898042       46.105.132.156        192.168.1.23          TCP      2946   443 → 59718 [PSH, ACK] Seq=14711 Ack=4322 Win=64128 Len=2880 TSval=2253460790 TSecr=393701332 [TCP segment of a reassembled PDU]

Frame 356: 2946 bytes on wire (23568 bits), 2946 bytes captured (23568 bits)
Ethernet II, Src: SagemcomBroa_35:92:33 (38:35:fb:35:92:33), Dst: AzureWaveTec_50:78:a5 (b4:8c:9d:50:78:a5)
Internet Protocol Version 4, Src: 46.105.132.156, Dst: 192.168.1.23
Transmission Control Protocol, Src Port: 443, Dst Port: 59718, Seq: 14711, Ack: 4322, Len: 2880

No.     Time           Source                Destination           Protocol Length Info
    357 4.898049       46.105.132.156        192.168.1.23          TCP      2946   443 → 59718 [PSH, ACK] Seq=17591 Ack=4322 Win=64128 Len=2880 TSval=2253460790 TSecr=393701332 [TCP segment of a reassembled PDU]

Frame 357: 2946 bytes on wire (23568 bits), 2946 bytes captured (23568 bits)
Ethernet II, Src: SagemcomBroa_35:92:33 (38:35:fb:35:92:33), Dst: AzureWaveTec_50:78:a5 (b4:8c:9d:50:78:a5)
Internet Protocol Version 4, Src: 46.105.132.156, Dst: 192.168.1.23
Transmission Control Protocol, Src Port: 443, Dst Port: 59718, Seq: 17591, Ack: 4322, Len: 2880

No.     Time           Source                Destination           Protocol Length Info
    358 4.898051       46.105.132.156        192.168.1.23          TCP      2946   443 → 59718 [PSH, ACK] Seq=20471 Ack=4322 Win=64128 Len=2880 TSval=2253460790 TSecr=393701332 [TCP segment of a reassembled PDU]

Frame 358: 2946 bytes on wire (23568 bits), 2946 bytes captured (23568 bits)
Ethernet II, Src: SagemcomBroa_35:92:33 (38:35:fb:35:92:33), Dst: AzureWaveTec_50:78:a5 (b4:8c:9d:50:78:a5)
Internet Protocol Version 4, Src: 46.105.132.156, Dst: 192.168.1.23
Transmission Control Protocol, Src Port: 443, Dst Port: 59718, Seq: 20471, Ack: 4322, Len: 2880

No.     Time           Source                Destination           Protocol Length Info
    359 4.898176       192.168.1.23          46.105.132.156        TCP      66     59718 → 443 [ACK] Seq=4322 Ack=23351 Win=64128 Len=0 TSval=393701480 TSecr=2253460790

Frame 359: 66 bytes on wire (528 bits), 66 bytes captured (528 bits)
Ethernet II, Src: AzureWaveTec_50:78:a5 (b4:8c:9d:50:78:a5), Dst: SagemcomBroa_35:92:33 (38:35:fb:35:92:33)
Internet Protocol Version 4, Src: 192.168.1.23, Dst: 46.105.132.156
Transmission Control Protocol, Src Port: 59718, Dst Port: 443, Seq: 4322, Ack: 23351, Len: 0

No.     Time           Source                Destination           Protocol Length Info
    360 4.898282       46.105.132.156        192.168.1.23          TCP      1506   443 → 59718 [ACK] Seq=23351 Ack=4322 Win=64128 Len=1440 TSval=2253460790 TSecr=393701332 [TCP segment of a reassembled PDU]

Frame 360: 1506 bytes on wire (12048 bits), 1506 bytes captured (12048 bits)
Ethernet II, Src: SagemcomBroa_35:92:33 (38:35:fb:35:92:33), Dst: AzureWaveTec_50:78:a5 (b4:8c:9d:50:78:a5)
Internet Protocol Version 4, Src: 46.105.132.156, Dst: 192.168.1.23
Transmission Control Protocol, Src Port: 443, Dst Port: 59718, Seq: 23351, Ack: 4322, Len: 1440

No.     Time           Source                Destination           Protocol Length Info
    361 4.899286       46.105.132.156        192.168.1.23          TCP      1506   443 → 59718 [PSH, ACK] Seq=24791 Ack=4322 Win=64128 Len=1440 TSval=2253460790 TSecr=393701332 [TCP segment of a reassembled PDU]

Frame 361: 1506 bytes on wire (12048 bits), 1506 bytes captured (12048 bits)
Ethernet II, Src: SagemcomBroa_35:92:33 (38:35:fb:35:92:33), Dst: AzureWaveTec_50:78:a5 (b4:8c:9d:50:78:a5)
Internet Protocol Version 4, Src: 46.105.132.156, Dst: 192.168.1.23
Transmission Control Protocol, Src Port: 443, Dst Port: 59718, Seq: 24791, Ack: 4322, Len: 1440

No.     Time           Source                Destination           Protocol Length Info
    362 4.899308       192.168.1.23          46.105.132.156        TCP      66     59718 → 443 [ACK] Seq=4322 Ack=26231 Win=64128 Len=0 TSval=393701481 TSecr=2253460790

Frame 362: 66 bytes on wire (528 bits), 66 bytes captured (528 bits)
Ethernet II, Src: AzureWaveTec_50:78:a5 (b4:8c:9d:50:78:a5), Dst: SagemcomBroa_35:92:33 (38:35:fb:35:92:33)
Internet Protocol Version 4, Src: 192.168.1.23, Dst: 46.105.132.156
Transmission Control Protocol, Src Port: 59718, Dst Port: 443, Seq: 4322, Ack: 26231, Len: 0

No.     Time           Source                Destination           Protocol Length Info
    363 4.912841       46.105.132.156        192.168.1.23          TLSv1.3  1240   Application Data

Frame 363: 1240 bytes on wire (9920 bits), 1240 bytes captured (9920 bits)
Ethernet II, Src: SagemcomBroa_35:92:33 (38:35:fb:35:92:33), Dst: AzureWaveTec_50:78:a5 (b4:8c:9d:50:78:a5)
Internet Protocol Version 4, Src: 46.105.132.156, Dst: 192.168.1.23
Transmission Control Protocol, Src Port: 443, Dst Port: 59718, Seq: 26231, Ack: 4322, Len: 1174
[7 Reassembled TCP Segments (15574 bytes): #355(2880), #356(2880), #357(2880), #358(2880), #360(1440), #361(1440), #363(1174)]
Transport Layer Security

No.     Time           Source                Destination           Protocol Length Info
    364 4.956113       192.168.1.23          46.105.132.156        TCP      66     59718 → 443 [ACK] Seq=4322 Ack=27405 Win=64128 Len=0 TSval=393701538 TSecr=2253460807

Frame 364: 66 bytes on wire (528 bits), 66 bytes captured (528 bits)
Ethernet II, Src: AzureWaveTec_50:78:a5 (b4:8c:9d:50:78:a5), Dst: SagemcomBroa_35:92:33 (38:35:fb:35:92:33)
Internet Protocol Version 4, Src: 192.168.1.23, Dst: 46.105.132.156
Transmission Control Protocol, Src Port: 59718, Dst Port: 443, Seq: 4322, Ack: 27405, Len: 0

No.     Time           Source                Destination           Protocol Length Info
    389 6.706167       192.168.1.23          46.105.132.156        TLSv1.3  301    Application Data

Frame 389: 301 bytes on wire (2408 bits), 301 bytes captured (2408 bits)
Ethernet II, Src: AzureWaveTec_50:78:a5 (b4:8c:9d:50:78:a5), Dst: SagemcomBroa_35:92:33 (38:35:fb:35:92:33)
Internet Protocol Version 4, Src: 192.168.1.23, Dst: 46.105.132.156
Transmission Control Protocol, Src Port: 59718, Dst Port: 443, Seq: 4322, Ack: 27405, Len: 235
Transport Layer Security

No.     Time           Source                Destination           Protocol Length Info
    390 6.730143       46.105.132.156        192.168.1.23          TCP      66     443 → 59718 [ACK] Seq=27405 Ack=4557 Win=64128 Len=0 TSval=2253462623 TSecr=393703288

Frame 390: 66 bytes on wire (528 bits), 66 bytes captured (528 bits)
Ethernet II, Src: SagemcomBroa_35:92:33 (38:35:fb:35:92:33), Dst: AzureWaveTec_50:78:a5 (b4:8c:9d:50:78:a5)
Internet Protocol Version 4, Src: 46.105.132.156, Dst: 192.168.1.23
Transmission Control Protocol, Src Port: 443, Dst Port: 59718, Seq: 27405, Ack: 4557, Len: 0

No.     Time           Source                Destination           Protocol Length Info
    391 6.799514       46.105.132.156        192.168.1.23          TLSv1.3  1211   Application Data

Frame 391: 1211 bytes on wire (9688 bits), 1211 bytes captured (9688 bits)
Ethernet II, Src: SagemcomBroa_35:92:33 (38:35:fb:35:92:33), Dst: AzureWaveTec_50:78:a5 (b4:8c:9d:50:78:a5)
Internet Protocol Version 4, Src: 46.105.132.156, Dst: 192.168.1.23
Transmission Control Protocol, Src Port: 443, Dst Port: 59718, Seq: 27405, Ack: 4557, Len: 1145
Transport Layer Security

No.     Time           Source                Destination           Protocol Length Info
    392 6.799544       192.168.1.23          46.105.132.156        TCP      66     59718 → 443 [ACK] Seq=4557 Ack=28550 Win=64128 Len=0 TSval=393703381 TSecr=2253462694

Frame 392: 66 bytes on wire (528 bits), 66 bytes captured (528 bits)
Ethernet II, Src: AzureWaveTec_50:78:a5 (b4:8c:9d:50:78:a5), Dst: SagemcomBroa_35:92:33 (38:35:fb:35:92:33)
Internet Protocol Version 4, Src: 192.168.1.23, Dst: 46.105.132.156
Transmission Control Protocol, Src Port: 59718, Dst Port: 443, Seq: 4557, Ack: 28550, Len: 0

No.     Time           Source                Destination           Protocol Length Info
    395 8.975659       192.168.1.23          46.105.132.156        TLSv1.3  208    Application Data

Frame 395: 208 bytes on wire (1664 bits), 208 bytes captured (1664 bits)
Ethernet II, Src: AzureWaveTec_50:78:a5 (b4:8c:9d:50:78:a5), Dst: SagemcomBroa_35:92:33 (38:35:fb:35:92:33)
Internet Protocol Version 4, Src: 192.168.1.23, Dst: 46.105.132.156
Transmission Control Protocol, Src Port: 59718, Dst Port: 443, Seq: 4557, Ack: 28550, Len: 142
Transport Layer Security

No.     Time           Source                Destination           Protocol Length Info
    396 8.979068       192.168.1.23          46.105.132.156        TLSv1.3  164    Application Data

Frame 396: 164 bytes on wire (1312 bits), 164 bytes captured (1312 bits)
Ethernet II, Src: AzureWaveTec_50:78:a5 (b4:8c:9d:50:78:a5), Dst: SagemcomBroa_35:92:33 (38:35:fb:35:92:33)
Internet Protocol Version 4, Src: 192.168.1.23, Dst: 46.105.132.156
Transmission Control Protocol, Src Port: 59718, Dst Port: 443, Seq: 4699, Ack: 28550, Len: 98
Transport Layer Security

No.     Time           Source                Destination           Protocol Length Info
    397 8.989919       192.168.1.23          46.105.132.156        TLSv1.3  249    Application Data

Frame 397: 249 bytes on wire (1992 bits), 249 bytes captured (1992 bits)
Ethernet II, Src: AzureWaveTec_50:78:a5 (b4:8c:9d:50:78:a5), Dst: SagemcomBroa_35:92:33 (38:35:fb:35:92:33)
Internet Protocol Version 4, Src: 192.168.1.23, Dst: 46.105.132.156
Transmission Control Protocol, Src Port: 59718, Dst Port: 443, Seq: 4797, Ack: 28550, Len: 183
Transport Layer Security

No.     Time           Source                Destination           Protocol Length Info
    398 8.990012       192.168.1.23          46.105.132.156        TLSv1.3  801    Application Data

Frame 398: 801 bytes on wire (6408 bits), 801 bytes captured (6408 bits)
Ethernet II, Src: AzureWaveTec_50:78:a5 (b4:8c:9d:50:78:a5), Dst: SagemcomBroa_35:92:33 (38:35:fb:35:92:33)
Internet Protocol Version 4, Src: 192.168.1.23, Dst: 46.105.132.156
Transmission Control Protocol, Src Port: 59718, Dst Port: 443, Seq: 4980, Ack: 28550, Len: 735
Transport Layer Security

No.     Time           Source                Destination           Protocol Length Info
    399 8.991921       46.105.132.156        192.168.1.23          TCP      66     443 → 59718 [ACK] Seq=28550 Ack=4699 Win=64128 Len=0 TSval=2253464887 TSecr=393705557

Frame 399: 66 bytes on wire (528 bits), 66 bytes captured (528 bits)
Ethernet II, Src: SagemcomBroa_35:92:33 (38:35:fb:35:92:33), Dst: AzureWaveTec_50:78:a5 (b4:8c:9d:50:78:a5)
Internet Protocol Version 4, Src: 46.105.132.156, Dst: 192.168.1.23
Transmission Control Protocol, Src Port: 443, Dst Port: 59718, Seq: 28550, Ack: 4699, Len: 0

No.     Time           Source                Destination           Protocol Length Info
    400 8.992947       46.105.132.156        192.168.1.23          TCP      66     443 → 59718 [ACK] Seq=28550 Ack=4797 Win=64128 Len=0 TSval=2253464888 TSecr=393705560

Frame 400: 66 bytes on wire (528 bits), 66 bytes captured (528 bits)
Ethernet II, Src: SagemcomBroa_35:92:33 (38:35:fb:35:92:33), Dst: AzureWaveTec_50:78:a5 (b4:8c:9d:50:78:a5)
Internet Protocol Version 4, Src: 46.105.132.156, Dst: 192.168.1.23
Transmission Control Protocol, Src Port: 443, Dst Port: 59718, Seq: 28550, Ack: 4797, Len: 0

No.     Time           Source                Destination           Protocol Length Info
    401 9.003926       46.105.132.156        192.168.1.23          TCP      66     443 → 59718 [ACK] Seq=28550 Ack=4980 Win=64128 Len=0 TSval=2253464899 TSecr=393705571

Frame 401: 66 bytes on wire (528 bits), 66 bytes captured (528 bits)
Ethernet II, Src: SagemcomBroa_35:92:33 (38:35:fb:35:92:33), Dst: AzureWaveTec_50:78:a5 (b4:8c:9d:50:78:a5)
Internet Protocol Version 4, Src: 46.105.132.156, Dst: 192.168.1.23
Transmission Control Protocol, Src Port: 443, Dst Port: 59718, Seq: 28550, Ack: 4980, Len: 0

No.     Time           Source                Destination           Protocol Length Info
    402 9.004887       46.105.132.156        192.168.1.23          TCP      66     443 → 59718 [ACK] Seq=28550 Ack=5715 Win=64128 Len=0 TSval=2253464900 TSecr=393705571

Frame 402: 66 bytes on wire (528 bits), 66 bytes captured (528 bits)
Ethernet II, Src: SagemcomBroa_35:92:33 (38:35:fb:35:92:33), Dst: AzureWaveTec_50:78:a5 (b4:8c:9d:50:78:a5)
Internet Protocol Version 4, Src: 46.105.132.156, Dst: 192.168.1.23
Transmission Control Protocol, Src Port: 443, Dst Port: 59718, Seq: 28550, Ack: 5715, Len: 0

No.     Time           Source                Destination           Protocol Length Info
    403 9.014196       46.105.132.156        192.168.1.23          TLSv1.3  114    Application Data

Frame 403: 114 bytes on wire (912 bits), 114 bytes captured (912 bits)
Ethernet II, Src: SagemcomBroa_35:92:33 (38:35:fb:35:92:33), Dst: AzureWaveTec_50:78:a5 (b4:8c:9d:50:78:a5)
Internet Protocol Version 4, Src: 46.105.132.156, Dst: 192.168.1.23
Transmission Control Protocol, Src Port: 443, Dst Port: 59718, Seq: 28550, Ack: 5715, Len: 48
Transport Layer Security

No.     Time           Source                Destination           Protocol Length Info
    404 9.014232       192.168.1.23          46.105.132.156        TCP      66     59718 → 443 [ACK] Seq=5715 Ack=28598 Win=64128 Len=0 TSval=393705596 TSecr=2253464900

Frame 404: 66 bytes on wire (528 bits), 66 bytes captured (528 bits)
Ethernet II, Src: AzureWaveTec_50:78:a5 (b4:8c:9d:50:78:a5), Dst: SagemcomBroa_35:92:33 (38:35:fb:35:92:33)
Internet Protocol Version 4, Src: 192.168.1.23, Dst: 46.105.132.156
Transmission Control Protocol, Src Port: 59718, Dst Port: 443, Seq: 5715, Ack: 28598, Len: 0

No.     Time           Source                Destination           Protocol Length Info
    405 9.054578       46.105.132.156        192.168.1.23          TLSv1.3  960    Application Data

Frame 405: 960 bytes on wire (7680 bits), 960 bytes captured (7680 bits)
Ethernet II, Src: SagemcomBroa_35:92:33 (38:35:fb:35:92:33), Dst: AzureWaveTec_50:78:a5 (b4:8c:9d:50:78:a5)
Internet Protocol Version 4, Src: 46.105.132.156, Dst: 192.168.1.23
Transmission Control Protocol, Src Port: 443, Dst Port: 59718, Seq: 28598, Ack: 5715, Len: 894
Transport Layer Security

No.     Time           Source                Destination           Protocol Length Info
